"I60","Stroke",1,16,0.99999994,1.19209289550781e-07,0.99999994,1.19209289550781e-07,16,1,204,204,0,5.96046447753905e-08,4.28862688018054e-07,TRUE,TRUE,"stroke","Stroke",494,3,"G45-G46.8, I60-I62, I62.9-I64, I64.1, I65-I69.998","I60-I69.4","430-439.6, V12.54, V17.1","430-437.9","Non-communicable diseases","Cardiovascular diseases","Stroke","","icd10","both_sexes","","","I60 Subarachnoid haemorrhage","truncated: true",NA,"Chapter IX Diseases of the circulatory system | I60-I69 Cerebrovascular diseases | I60 Subarachnoid haemorrhage",985,615,370,NA,NA,NA,"EUR",1,"",0,NA,NA,NA,NA,985,NA,NA,NA,NA,NA,419546,NA,NA,NA,NA,NA,2e-04,NA,NA,NA,NA,NA,0.0023,NA,NA,NA,NA,NA,0.00873,NA,NA,NA,NA,NA,0.1,NA,NA,NA,NA,NA,0.087,NA,NA,NA,NA,NA,1.01,NA,NA,NA,NA,NA,"h2_z_insignificant",NA,FALSE,"icd10-I60-both_sexes.tsv.bgz","icd10-I60-both_sexes.tsv.bgz.tbi","https://pan-ukb-us-east-1.s3.amazonaws.com/sumstats_flat_files/icd10-I60-both_sexes.tsv.bgz","https://pan-ukb-us-east-1.s3.amazonaws.com/sumstats_flat_files_tabix/icd10-I60-both_sexes.tsv.bgz.tbi","wget https://pan-ukb-us-east-1.s3.amazonaws.com/sumstats_flat_files/icd10-I60-both_sexes.tsv.bgz","wget https://pan-ukb-us-east-1.s3.amazonaws.com/sumstats_flat_files_tabix/icd10-I60-both_sexes.tsv.bgz.tbi","5aae14fd20f60941be5484d9bac1fefa",538098507,"1c87e55008f8e0b18db12a4bda764747",1751095,"EFO_0000713","subarachnoid hemorrhage","Cardiovascular disease",985
"C15","Neoplasms",1,16,0.98333329,1.19209289550781e-07,0.98333329,1.19209289550781e-07,16,1,204,204,0,5.96046447753905e-08,4.28862688018054e-07,TRUE,TRUE,"neoplasms","Neoplasms",410,2,"C00-C45.9, C46.6, C47-C79.9, C8-D24.9, D26.0-D39.9, D4-D49.9, D54, E34.0, K62.0-K62.3, K63.5, N60-N60.99, N84.0-N84.1, N87-N87.9","C44.01-D24.9, D26.0-D49.9, E34.0, K62.0-K62.1, K63.5, N60-N60.99, N84.0-N84.1, N87-N87.9","140-175.9, 177-217.8, 219-237.6, 237.70-237.72, 237.9-239.9, 569.0, 610-610.9, 622.1-622.2, 622.7, V07.39, V10-V11, V13.22-V13.24, V16-V16.9, V42.4, V42.81-V42.82, V59.2-V59.3, V72.32, V76-V76.9","173.01-217.8, 219-237.6, 237.70-237.72, 237.9-239.9, 569.0, 610-610.9, 622.1-622.2, 622.7","Non-communicable diseases","Neoplasms","","","icd10","both_sexes","","","C15 Malignant neoplasm of oesophagus","truncated: true",NA,"Chapter II Neoplasms | C15-C26 Malignant neoplasms of digestive organs | C15 Malignant neoplasm of oesophagus",975,235,740,NA,NA,NA,"EUR",1,"",0,NA,NA,NA,NA,975,NA,NA,NA,NA,NA,419556,NA,NA,NA,NA,NA,0.0023,NA,NA,NA,NA,NA,0.0022,NA,NA,NA,NA,NA,0.101,NA,NA,NA,NA,NA,0.0968,NA,NA,NA,NA,NA,1.05,NA,NA,NA,NA,NA,0.997,NA,NA,NA,NA,NA,"h2_z_insignificant",NA,FALSE,"icd10-C15-both_sexes.tsv.bgz","icd10-C15-both_sexes.tsv.bgz.tbi","https://pan-ukb-us-east-1.s3.amazonaws.com/sumstats_flat_files/icd10-C15-both_sexes.tsv.bgz","https://pan-ukb-us-east-1.s3.amazonaws.com/sumstats_flat_files_tabix/icd10-C15-both_sexes.tsv.bgz.tbi","wget https://pan-ukb-us-east-1.s3.amazonaws.com/sumstats_flat_files/icd10-C15-both_sexes.tsv.bgz","wget https://pan-ukb-us-east-1.s3.amazonaws.com/sumstats_flat_files_tabix/icd10-C15-both_sexes.tsv.bgz.tbi","2e8838c1407b96880fd780fcf11ddc85",537893193,"f7f9cf13b0933f78c181fd4b2ff69ac5",1751059,"EFO_0002916","esophageal carcinoma","Cancer",975
"G31","Alzheimer's disease and other dementias",1,16,0.974679351,2.38418579101562e-07,0.974679351,2.38418579101562e-07,13,1,204,204,0,1.19209289550781e-07,6.39395280317825e-07,TRUE,TRUE,"alzheimer's disease and other dementias","Alzheimer's disease and other dementias",543,3,"F00-F02.0, F02.8-F03.91, F06.2, G30-G31.1, G31.8-G32.89","F00-F02.0, F02.8-F06.2, G30-G31.1, G31.8-G32.89","290-290.9, 294.0-294.9, 331-331.2, 331.6-331.7, 331.82, 331.89-331.9","290-290.9, 294.0-294.9, 331-331.7, 331.82-331.9","Non-communicable diseases","Neurological disorders","Alzheimer's disease and other dementias","","icd10","both_sexes","","","G31 Other degenerative diseases of nervous system, not elsewhere classified","truncated: true",NA,"Chapter VI Diseases of the nervous system | G30-G32 Other degenerative diseases of the nervous system | G31 Other degenerative diseases of nervous system, not elsewhere classified",963,348,615,NA,NA,NA,"EUR",1,"",0,NA,NA,NA,NA,963,NA,NA,NA,NA,NA,419568,NA,NA,NA,NA,NA,0.0022,NA,NA,NA,NA,NA,0.0023,NA,NA,NA,NA,NA,0.0978,NA,NA,NA,NA,NA,0.102,NA,NA,NA,NA,NA,0.957,NA,NA,NA,NA,NA,1.02,NA,NA,NA,NA,NA,"h2_z_insignificant",NA,FALSE,"icd10-G31-both_sexes.tsv.bgz","icd10-G31-both_sexes.tsv.bgz.tbi","https://pan-ukb-us-east-1.s3.amazonaws.com/sumstats_flat_files/icd10-G31-both_sexes.tsv.bgz","https://pan-ukb-us-east-1.s3.amazonaws.com/sumstats_flat_files_tabix/icd10-G31-both_sexes.tsv.bgz.tbi","wget https://pan-ukb-us-east-1.s3.amazonaws.com/sumstats_flat_files/icd10-G31-both_sexes.tsv.bgz","wget https://pan-ukb-us-east-1.s3.amazonaws.com/sumstats_flat_files_tabix/icd10-G31-both_sexes.tsv.bgz.tbi","6c587ae7f96e3bbe42d92bcc9063f3da",537892329,"9cf3a25c90fe59478a320d32411e55b4",1751254,NA,NA,NA,963
"D03","Other benign and in situ neoplasms",1,11,0.963636458,5.16176223754883e-05,0.366666645,0.052871585,16,0.970588235294118,204,198,0,2.58088111877442e-05,5.99496007904293e-05,TRUE,TRUE,"other benign and in situ neoplasms","Other benign and in situ neoplasms",967,4,"D00-D00.2, D02-D05.92, D07, D07.1-D11.9, D13-D13.2, D13.4-D13.7, D14-D24.9, D27-D37.1, D37.6-D39, D39.1-D39.9, D4-D44.9, D48-D49.9, N60-N60.99","D00-D00.2, D02-D05.92, D07, D07.1-D11.9, D13-D13.2, D13.4-D13.7, D14-D24.9, D27-D37.1, D37.6-D39, D39.1-D3A.00, D3A.090-D44.9, D48-D49.9, N60-N60.99","209.61, 209.63-209.67, 210.0-211.1, 211.5-217.8, 220-230.2, 230.8-233.0, 233.3-235.1, 235.3-236, 236.1-237.6, 237.70-237.72, 237.9-238.3, 239-239.9","209.61-211.1, 211.5-217.8, 220-230.2, 230.8-233.0, 233.3-235.1, 235.3-236, 236.1-237.6, 237.70-237.72, 237.9-238.3, 239-239.9, 610-610.9","Non-communicable diseases","Neoplasms","Other neoplasms","Other benign and in situ neoplasms","icd10","both_sexes","","","D03 Melanoma in situ","truncated: true",NA,"Chapter II Neoplasms | D00-D09 In situ neoplasms | D03 Melanoma in situ",956,512,444,NA,NA,NA,"EUR",1,"",0,NA,NA,NA,NA,956,NA,NA,NA,NA,NA,419575,NA,NA,NA,NA,NA,-0.0018,NA,NA,NA,NA,NA,0.0022,NA,NA,NA,NA,NA,-0.0805,NA,NA,NA,NA,NA,0.0984,NA,NA,NA,NA,NA,-0.818,NA,NA,NA,NA,NA,1.05,NA,NA,NA,NA,NA,"h2_z_insignificant",NA,FALSE,"icd10-D03-both_sexes.tsv.bgz","icd10-D03-both_sexes.tsv.bgz.tbi","https://pan-ukb-us-east-1.s3.amazonaws.com/sumstats_flat_files/icd10-D03-both_sexes.tsv.bgz","https://pan-ukb-us-east-1.s3.amazonaws.com/sumstats_flat_files_tabix/icd10-D03-both_sexes.tsv.bgz.tbi","wget https://pan-ukb-us-east-1.s3.amazonaws.com/sumstats_flat_files/icd10-D03-both_sexes.tsv.bgz","wget https://pan-ukb-us-east-1.s3.amazonaws.com/sumstats_flat_files_tabix/icd10-D03-both_sexes.tsv.bgz.tbi","a01cdf61ed1180009df21115ba13b4aa",538023638,"8b1b413acf292517eff02b36a76fcf9c",1750869,"EFO_0004957",NA,NA,956
"L81","Other skin and subcutaneous diseases",1,15,0.99999994,2.38418579101562e-07,0.966666579,2.38418579101562e-07,16,1,204,204,0,1.19209289550781e-07,6.39395280317825e-07,TRUE,TRUE,"other skin and subcutaneous diseases","Other skin and subcutaneous diseases",668,3,"B85-B85.4, B87-B88.9, D86.3, E80.1-E80.29, L10-L14.0, L28-L28.2, L42-L45, L49-L49.9, L51-L54.8, L56, L56.2-L57.9, L59-L60.9, L62-L62.8, L64, L64.8-L68.9, L71-L75.9, L80-L87.9, L90-L92.9, L94-L95.9, L98.5-L99.8","B85-B85.4, B87-B88.9, L10-L14.0, L28-L28.2, L42-L49.9, L51-L54.8, L56, L56.2-L57.9, L59-L62.8, L64, L64.8-L68.9, L71-L75.9, L80-L87.9, L90-L92.9, L94-L95.9, L98.5-L99.8","132-132.9, 133.8-134.9, 136.1, 692.70-692.77, 693-695.9, 697-697.9, 700-704, 704.1-706, 706.2-706.9, 707.1-707.19, 707.8-707.9, 709-709.3, 709.8-709.9","132-132.9, 133.8-134.9, 136.1, 692.70-692.77, 693-695.9, 697-697.9, 700-704, 704.1-706, 706.2-706.9, 707.1-707.19, 707.8-707.9, 709-709.3, 709.8-709.9","Non-communicable diseases","Skin and subcutaneous diseases","Other skin and subcutaneous diseases","","icd10","both_sexes","","","L81 Other disorders of pigmentation","truncated: true",NA,"Chapter XII Diseases of the skin and subcutaneous tissue | L80-L99 Other disorders of the skin and subcutaneous tissue | L81 Other disorders of pigmentation",954,582,372,NA,NA,NA,"EUR",1,"",0,NA,NA,NA,NA,954,NA,NA,NA,NA,NA,419577,NA,NA,NA,NA,NA,0.004,NA,NA,NA,NA,NA,0.0022,NA,NA,NA,NA,NA,0.179,NA,NA,NA,NA,NA,0.0986,NA,NA,NA,NA,NA,1.82,NA,NA,NA,NA,NA,1.02,NA,NA,NA,NA,NA,"h2_z_insignificant",NA,FALSE,"icd10-L81-both_sexes.tsv.bgz","icd10-L81-both_sexes.tsv.bgz.tbi","https://pan-ukb-us-east-1.s3.amazonaws.com/sumstats_flat_files/icd10-L81-both_sexes.tsv.bgz","https://pan-ukb-us-east-1.s3.amazonaws.com/sumstats_flat_files_tabix/icd10-L81-both_sexes.tsv.bgz.tbi","wget https://pan-ukb-us-east-1.s3.amazonaws.com/sumstats_flat_files/icd10-L81-both_sexes.tsv.bgz","wget https://pan-ukb-us-east-1.s3.amazonaws.com/sumstats_flat_files_tabix/icd10-L81-both_sexes.tsv.bgz.tbi","08ce7a5d33f2427c5912bc07ecb34724",538123880,"43c69ea7c59f6472644c7576adc44809",1750798,"EFO_1000755","pigmentation disease","Other disease",954
"I89","Cardiovascular diseases",1,16,0.98333329,1.19209289550781e-07,0.98333329,1.19209289550781e-07,16,1,204,204,0,5.96046447753905e-08,4.28862688018054e-07,TRUE,TRUE,"cardiovascular diseases","Cardiovascular diseases",491,2,"B33.2-B33.24, D86.85, G45-G46.8, I00.0-I01.9, I02.0, I03-I11.9, I14-I27.0, I27.2-I83.93, I86-I89.0, I89.9-I95.1, I98, I98.4-ID5.9, K75.1, R00-R01.2, R07-R07.9","A32.82, B33.2-B33.24, B37.6, I01-I09.9, I20-I27.0, I33-I73.9","074.2, 074.21-074.23, 391-391.9, 392.0, 393-398.99, 402-402.91, 410-416.0, 417-417.9, 420-425.5, 425.7-440.29, 440.4-445.89, 447-454.9, 456, 456.3-457, 457.1, 457.8-458.1, 459-459.9, 785-785.3, V12.5-V12.59, V15.1, V17.1, V17.3-V17.49, V42.1-V42.2, V43.2-V43.5, V45.0-V45.09, V45.81-V45.82, V47.2, V58.61, V58.63, V58.66, V58.73, V81-V81.2","074.2-074.23, 112.81-115.94, 391-398.99, 410-416.0, 421-440.29, 440.4-443.9","Non-communicable diseases","Cardiovascular diseases","","","icd10","both_sexes","","","I89 Other non-infective disorders of lymphatic vessels and lymph nodes","truncated: true",NA,"Chapter IX Diseases of the circulatory system | I80-I89 Diseases of veins, lymphatic vessels and lymph nodes, not elsewhere classified | I89 Other non-infective disorders of lymphatic vessels and lymph nodes",948,567,381,NA,NA,NA,"EUR",1,"",0,NA,NA,NA,NA,948,NA,NA,NA,NA,NA,419583,NA,NA,NA,NA,NA,0.0017,NA,NA,NA,NA,NA,0.0022,NA,NA,NA,NA,NA,0.0766,NA,NA,NA,NA,NA,0.0991,NA,NA,NA,NA,NA,0.773,NA,NA,NA,NA,NA,1.02,NA,NA,NA,NA,NA,"h2_z_insignificant",NA,FALSE,"icd10-I89-both_sexes.tsv.bgz","icd10-I89-both_sexes.tsv.bgz.tbi","https://pan-ukb-us-east-1.s3.amazonaws.com/sumstats_flat_files/icd10-I89-both_sexes.tsv.bgz","https://pan-ukb-us-east-1.s3.amazonaws.com/sumstats_flat_files_tabix/icd10-I89-both_sexes.tsv.bgz.tbi","wget https://pan-ukb-us-east-1.s3.amazonaws.com/sumstats_flat_files/icd10-I89-both_sexes.tsv.bgz","wget https://pan-ukb-us-east-1.s3.amazonaws.com/sumstats_flat_files_tabix/icd10-I89-both_sexes.tsv.bgz.tbi","6c80ac8eae7fd1ffe4318c0e4518227d",536887198,"55257519d7dc11111a2b435f16305016",1750385,"EFO_0007352","lymphatic system disease","Immune system disorder",948
"D41","Neoplasms",1,16,0.98333329,1.19209289550781e-07,0.98333329,1.19209289550781e-07,16,1,204,204,0,5.96046447753905e-08,4.28862688018054e-07,TRUE,TRUE,"neoplasms","Neoplasms",410,2,"C00-C45.9, C46.6, C47-C79.9, C8-D24.9, D26.0-D39.9, D4-D49.9, D54, E34.0, K62.0-K62.3, K63.5, N60-N60.99, N84.0-N84.1, N87-N87.9","C44.01-D24.9, D26.0-D49.9, E34.0, K62.0-K62.1, K63.5, N60-N60.99, N84.0-N84.1, N87-N87.9","140-175.9, 177-217.8, 219-237.6, 237.70-237.72, 237.9-239.9, 569.0, 610-610.9, 622.1-622.2, 622.7, V07.39, V10-V11, V13.22-V13.24, V16-V16.9, V42.4, V42.81-V42.82, V59.2-V59.3, V72.32, V76-V76.9","173.01-217.8, 219-237.6, 237.70-237.72, 237.9-239.9, 569.0, 610-610.9, 622.1-622.2, 622.7","Non-communicable diseases","Neoplasms","","","icd10","both_sexes","","","D41 Neoplasm of uncertain or unknown behaviour of urinary organs","truncated: true",NA,"Chapter II Neoplasms | D37-D48 Neoplasms of uncertain or unknown behaviour | D41 Neoplasm of uncertain or unknown behaviour of urinary organs",938,272,666,NA,NA,NA,"EUR",1,"",0,NA,NA,NA,NA,938,NA,NA,NA,NA,NA,419593,NA,NA,NA,NA,NA,0.0023,NA,NA,NA,NA,NA,0.0021,NA,NA,NA,NA,NA,0.104,NA,NA,NA,NA,NA,0.0954,NA,NA,NA,NA,NA,1.1,NA,NA,NA,NA,NA,0.99,NA,NA,NA,NA,NA,"h2_z_insignificant",NA,FALSE,"icd10-D41-both_sexes.tsv.bgz","icd10-D41-both_sexes.tsv.bgz.tbi","https://pan-ukb-us-east-1.s3.amazonaws.com/sumstats_flat_files/icd10-D41-both_sexes.tsv.bgz","https://pan-ukb-us-east-1.s3.amazonaws.com/sumstats_flat_files_tabix/icd10-D41-both_sexes.tsv.bgz.tbi","wget https://pan-ukb-us-east-1.s3.amazonaws.com/sumstats_flat_files/icd10-D41-both_sexes.tsv.bgz","wget https://pan-ukb-us-east-1.s3.amazonaws.com/sumstats_flat_files_tabix/icd10-D41-both_sexes.tsv.bgz.tbi","e602181168a5db9393af8b0ac782c331",537673203,"0aea146319741eb937f1791f5127cc98",1750731,"EFO_0003863","urogenital neoplasm","Other disease",938
"N21","Urolithiasis",1,9,0.944444418,0.000580668,-0.066666663,0.752641976,16,1,204,204,0,0.000290334,0.000594782,TRUE,TRUE,"urolithiasis","Urolithiasis",596,4,"N20-N23.0","N20-N23.0","592-592.9, 594-594.9","592-594.9","Non-communicable diseases","Other non-communicable diseases","Urinary diseases and male infertility","Urolithiasis","icd10","both_sexes","","","N21 Calculus of lower urinary tract","truncated: true",NA,"Chapter XIV Diseases of the genitourinary system | N20-N23 Urolithiasis | N21 Calculus of lower urinary tract",936,146,790,NA,NA,NA,"EUR",1,"",0,NA,NA,NA,NA,936,NA,NA,NA,NA,NA,419595,NA,NA,NA,NA,NA,8.71e-05,NA,NA,NA,NA,NA,0.0023,NA,NA,NA,NA,NA,0.00396,NA,NA,NA,NA,NA,0.105,NA,NA,NA,NA,NA,0.0379,NA,NA,NA,NA,NA,0.996,NA,NA,NA,NA,NA,"h2_z_insignificant",NA,FALSE,"icd10-N21-both_sexes.tsv.bgz","icd10-N21-both_sexes.tsv.bgz.tbi","https://pan-ukb-us-east-1.s3.amazonaws.com/sumstats_flat_files/icd10-N21-both_sexes.tsv.bgz","https://pan-ukb-us-east-1.s3.amazonaws.com/sumstats_flat_files_tabix/icd10-N21-both_sexes.tsv.bgz.tbi","wget https://pan-ukb-us-east-1.s3.amazonaws.com/sumstats_flat_files/icd10-N21-both_sexes.tsv.bgz","wget https://pan-ukb-us-east-1.s3.amazonaws.com/sumstats_flat_files_tabix/icd10-N21-both_sexes.tsv.bgz.tbi","d89bee187a0eb96e32ce7e6477d742a7",537517735,"4bfdf5cc98333e977678c97e24fa0fde",1751212,"EFO_1001228","ureterolithiasis","Other disease",936
"D04","Other benign and in situ neoplasms",1,11,0.963636458,5.16176223754883e-05,0.366666645,0.052871585,16,0.970588235294118,204,198,0,2.58088111877442e-05,5.99496007904293e-05,TRUE,TRUE,"other benign and in situ neoplasms","Other benign and in situ neoplasms",967,4,"D00-D00.2, D02-D05.92, D07, D07.1-D11.9, D13-D13.2, D13.4-D13.7, D14-D24.9, D27-D37.1, D37.6-D39, D39.1-D39.9, D4-D44.9, D48-D49.9, N60-N60.99","D00-D00.2, D02-D05.92, D07, D07.1-D11.9, D13-D13.2, D13.4-D13.7, D14-D24.9, D27-D37.1, D37.6-D39, D39.1-D3A.00, D3A.090-D44.9, D48-D49.9, N60-N60.99","209.61, 209.63-209.67, 210.0-211.1, 211.5-217.8, 220-230.2, 230.8-233.0, 233.3-235.1, 235.3-236, 236.1-237.6, 237.70-237.72, 237.9-238.3, 239-239.9","209.61-211.1, 211.5-217.8, 220-230.2, 230.8-233.0, 233.3-235.1, 235.3-236, 236.1-237.6, 237.70-237.72, 237.9-238.3, 239-239.9, 610-610.9","Non-communicable diseases","Neoplasms","Other neoplasms","Other benign and in situ neoplasms","icd10","both_sexes","","","D04 Carcinoma in situ of skin","truncated: true",NA,"Chapter II Neoplasms | D00-D09 In situ neoplasms | D04 Carcinoma in situ of skin",935,468,467,NA,NA,NA,"EUR",1,"",0,NA,NA,NA,NA,935,NA,NA,NA,NA,NA,419596,NA,NA,NA,NA,NA,0.0023,NA,NA,NA,NA,NA,0.0022,NA,NA,NA,NA,NA,0.105,NA,NA,NA,NA,NA,0.1,NA,NA,NA,NA,NA,1.05,NA,NA,NA,NA,NA,1,NA,NA,NA,NA,NA,"h2_z_insignificant",NA,FALSE,"icd10-D04-both_sexes.tsv.bgz","icd10-D04-both_sexes.tsv.bgz.tbi","https://pan-ukb-us-east-1.s3.amazonaws.com/sumstats_flat_files/icd10-D04-both_sexes.tsv.bgz","https://pan-ukb-us-east-1.s3.amazonaws.com/sumstats_flat_files_tabix/icd10-D04-both_sexes.tsv.bgz.tbi","wget https://pan-ukb-us-east-1.s3.amazonaws.com/sumstats_flat_files/icd10-D04-both_sexes.tsv.bgz","wget https://pan-ukb-us-east-1.s3.amazonaws.com/sumstats_flat_files_tabix/icd10-D04-both_sexes.tsv.bgz.tbi","a36aa2ab1995c93b77969142f036148f",537578941,"9d7611a076bbbafa5f94d17afcf4d674",1751142,"EFO_0004198","skin neoplasm","Cancer",935
"C25","Neoplasms",1,16,0.98333329,1.19209289550781e-07,0.98333329,1.19209289550781e-07,16,1,204,204,0,5.96046447753905e-08,4.28862688018054e-07,TRUE,TRUE,"neoplasms","Neoplasms",410,2,"C00-C45.9, C46.6, C47-C79.9, C8-D24.9, D26.0-D39.9, D4-D49.9, D54, E34.0, K62.0-K62.3, K63.5, N60-N60.99, N84.0-N84.1, N87-N87.9","C44.01-D24.9, D26.0-D49.9, E34.0, K62.0-K62.1, K63.5, N60-N60.99, N84.0-N84.1, N87-N87.9","140-175.9, 177-217.8, 219-237.6, 237.70-237.72, 237.9-239.9, 569.0, 610-610.9, 622.1-622.2, 622.7, V07.39, V10-V11, V13.22-V13.24, V16-V16.9, V42.4, V42.81-V42.82, V59.2-V59.3, V72.32, V76-V76.9","173.01-217.8, 219-237.6, 237.70-237.72, 237.9-239.9, 569.0, 610-610.9, 622.1-622.2, 622.7","Non-communicable diseases","Neoplasms","","","icd10","both_sexes","","","C25 Malignant neoplasm of pancreas","truncated: true",NA,"Chapter II Neoplasms | C15-C26 Malignant neoplasms of digestive organs | C25 Malignant neoplasm of pancreas",933,423,510,NA,NA,NA,"EUR",1,"",0,NA,NA,NA,NA,933,NA,NA,NA,NA,NA,419598,NA,NA,NA,NA,NA,8e-04,NA,NA,NA,NA,NA,0.0023,NA,NA,NA,NA,NA,0.0365,NA,NA,NA,NA,NA,0.105,NA,NA,NA,NA,NA,0.348,NA,NA,NA,NA,NA,1.04,NA,NA,NA,NA,NA,"h2_z_insignificant",NA,FALSE,"icd10-C25-both_sexes.tsv.bgz","icd10-C25-both_sexes.tsv.bgz.tbi","https://pan-ukb-us-east-1.s3.amazonaws.com/sumstats_flat_files/icd10-C25-both_sexes.tsv.bgz","https://pan-ukb-us-east-1.s3.amazonaws.com/sumstats_flat_files_tabix/icd10-C25-both_sexes.tsv.bgz.tbi","wget https://pan-ukb-us-east-1.s3.amazonaws.com/sumstats_flat_files/icd10-C25-both_sexes.tsv.bgz","wget https://pan-ukb-us-east-1.s3.amazonaws.com/sumstats_flat_files_tabix/icd10-C25-both_sexes.tsv.bgz.tbi","0d801117e75f46241201df5ed0292308",537925063,"67d359326446c60db1fd78998d4b21bc",1751151,"EFO_0002618","pancreatic carcinoma","Cancer",933
"I70","Lower extremity peripheral arterial disease",1,14,0.943730354,5.36441802978516e-06,0.83788228,1.04904174804688e-05,13,1,204,204,0,2.68220901489258e-06,8.1572336019929e-06,TRUE,TRUE,"lower extremity peripheral arterial disease","Lower extremity peripheral arterial disease",502,3,"I70.2-I70.92, I73-I73.9","I70.2-I73.9","440.2-440.29, 440.4-440.9, 443-443.2, 443.8-443.9","440.2-440.29, 440.4-443.9","Non-communicable diseases","Cardiovascular diseases","Lower extremity peripheral arterial disease","","icd10","both_sexes","","","I70 Atherosclerosis","truncated: true",NA,"Chapter IX Diseases of the circulatory system | I70-I79 Diseases of arteries, arterioles and capillaries | I70 Atherosclerosis",933,255,678,NA,NA,NA,"EUR",1,"",0,NA,NA,NA,NA,933,NA,NA,NA,NA,NA,419598,NA,NA,NA,NA,NA,-3.49e-05,NA,NA,NA,NA,NA,0.0021,NA,NA,NA,NA,NA,-0.00159,NA,NA,NA,NA,NA,0.0958,NA,NA,NA,NA,NA,-0.0166,NA,NA,NA,NA,NA,1,NA,NA,NA,NA,NA,"h2_z_insignificant",NA,FALSE,"icd10-I70-both_sexes.tsv.bgz","icd10-I70-both_sexes.tsv.bgz.tbi","https://pan-ukb-us-east-1.s3.amazonaws.com/sumstats_flat_files/icd10-I70-both_sexes.tsv.bgz","https://pan-ukb-us-east-1.s3.amazonaws.com/sumstats_flat_files_tabix/icd10-I70-both_sexes.tsv.bgz.tbi","wget https://pan-ukb-us-east-1.s3.amazonaws.com/sumstats_flat_files/icd10-I70-both_sexes.tsv.bgz","wget https://pan-ukb-us-east-1.s3.amazonaws.com/sumstats_flat_files_tabix/icd10-I70-both_sexes.tsv.bgz.tbi","7e7266cbb62497aa45455e5665d5f2a0",537730259,"f691bfed3972c75daed3daeef1b9a00c",1751032,"EFO_0003914","atherosclerosis","Cardiovascular disease",933
"D63","Chronic kidney disease",1,14,0.97802192,1.43051147460938e-06,0.849999964,5.48362731933594e-06,16,1,204,204,0,7.1525573730469e-07,2.57317612810834e-06,TRUE,TRUE,"chronic kidney disease","Chronic kidney disease",589,3,"D63.1, E08.2-E08.29, E10.2-E10.29, E11.2-E11.29, E12.2, E13.2-E13.29, E14.2, I12-I13.9, N02-N08.8, N15.0, N17-N19, Q60-Q63.2, Q63.8-Q63.9, Q64.2-Q64.9","D63.1, E08.2-E08.29, E10.2-E10.29, E11.2-E11.29, E12.2, E13.2-E13.29, E14.2, I12-I13.9, N02-N08.8, N15.0, N17-N19, P96.0-P96.0","249.4-249.41, 250.4-250.49, 285.21, 403-404.93, 581-587.9, 753.0-753.4, 753.6-753.9, V13.03-V13.09, V18.6, V18.69, V42.0, V45.1-V45.12, V45.73, V56-V56.8, V59.4, V81.5-V81.6","249.4-249.41, 250.4-250.49, 285.21, 403-404.93, 581-587.9","Non-communicable diseases","Diabetes and kidney diseases","Chronic kidney disease","","icd10","both_sexes","","","D63 Anaemia in chronic diseases classified elsewhere","truncated: true",NA,"Chapter III Diseases of the blood and blood-forming organs and certain disorders involving the immune mechanism | D60-D64 Aplastic and other anaemias | D63 Anaemia in chronic diseases classified elsewhere",920,487,433,NA,NA,NA,"EUR",1,"",0,NA,NA,NA,NA,920,NA,NA,NA,NA,NA,419611,NA,NA,NA,NA,NA,3e-04,NA,NA,NA,NA,NA,0.0021,NA,NA,NA,NA,NA,0.0138,NA,NA,NA,NA,NA,0.0969,NA,NA,NA,NA,NA,0.143,NA,NA,NA,NA,NA,1.01,NA,NA,NA,NA,NA,"h2_z_insignificant",NA,FALSE,"icd10-D63-both_sexes.tsv.bgz","icd10-D63-both_sexes.tsv.bgz.tbi","https://pan-ukb-us-east-1.s3.amazonaws.com/sumstats_flat_files/icd10-D63-both_sexes.tsv.bgz","https://pan-ukb-us-east-1.s3.amazonaws.com/sumstats_flat_files_tabix/icd10-D63-both_sexes.tsv.bgz.tbi","wget https://pan-ukb-us-east-1.s3.amazonaws.com/sumstats_flat_files/icd10-D63-both_sexes.tsv.bgz","wget https://pan-ukb-us-east-1.s3.amazonaws.com/sumstats_flat_files_tabix/icd10-D63-both_sexes.tsv.bgz.tbi","c082ac815cd972469677555383735e05",537608127,"3d1fc497f2308a4ef222be94b55806ff",1750705,NA,NA,NA,920
"R73","Diabetes and kidney diseases",1,13,0.974359095,4.76837158203125e-06,0.74999994,6.15119934082031e-05,16,1,204,204,0,2.38418579101562e-06,7.32640425364176e-06,TRUE,TRUE,"diabetes and kidney diseases","Diabetes and kidney diseases",974,2,"D63.1, E08-E08.9, E10-E14.9, I12-I13.9, N00-N08.8, N15.0, N17-N19, Q60-Q63.2, Q63.8-Q63.9, Q64.2-Q64.9, R73-R73.9","D63.1, E08-E08.9, E10-E14.9, I12-I13.9, N00-N08.8, N15.0, N17-N19, P96.0-P96.0","249-250.99, 285.21, 362.0-362.07, 403-404.93, 580-587.9, 753.0-753.4, 753.6-753.9, 790.2-790.29, V13.03-V13.09, V18-V18.0, V18.6, V18.69, V42.0, V42.83, V45.1-V45.12, V45.73, V45.85, V56-V56.8, V58.67, V59.4, V77.1, V81.5-V81.6","249-250.99, 285.21, 362.0-362.07, 403-404.93, 580-587.9","Non-communicable diseases","Diabetes and kidney diseases","","","icd10","both_sexes","","","R73 Elevated blood glucose level","truncated: true",NA,"Chapter XVIII Symptoms, signs and abnormal clinical and laboratory findings, not elsewhere classified | R70-R79 Abnormal findings on examination of blood, without diagnosis | R73 Elevated blood glucose level",917,414,503,NA,NA,NA,"CSA,EUR",2,"",0,NA,NA,52,NA,865,NA,NA,NA,8824,NA,419666,NA,NA,NA,0.0897,NA,-0.0021,NA,NA,NA,0.0415,NA,0.0023,NA,NA,NA,1.88,NA,-0.102,NA,NA,NA,0.873,NA,0.112,NA,NA,NA,2.16,NA,-0.913,NA,NA,NA,0.991,NA,0.967,NA,NA,NA,"h2_z_insignificant",NA,"h2_z_insignificant",NA,FALSE,"icd10-R73-both_sexes.tsv.bgz","icd10-R73-both_sexes.tsv.bgz.tbi","https://pan-ukb-us-east-1.s3.amazonaws.com/sumstats_flat_files/icd10-R73-both_sexes.tsv.bgz","https://pan-ukb-us-east-1.s3.amazonaws.com/sumstats_flat_files_tabix/icd10-R73-both_sexes.tsv.bgz.tbi","wget https://pan-ukb-us-east-1.s3.amazonaws.com/sumstats_flat_files/icd10-R73-both_sexes.tsv.bgz","wget https://pan-ukb-us-east-1.s3.amazonaws.com/sumstats_flat_files_tabix/icd10-R73-both_sexes.tsv.bgz.tbi","bf62e93b9c5a1eddc7e1268429b3244e",1051473968,"bf0dbe8421fc669cc03cede52528b62f",1919759,"EFO_0004468","glucose measurement","Other measurement",917
"L29","Skin and subcutaneous diseases",1,16,0.933333278,5.96046447753906e-07,0.933333278,5.96046447753906e-07,16,1,204,204,0,2.98023223876953e-07,1.31219180662241e-06,TRUE,TRUE,"skin and subcutaneous diseases","Skin and subcutaneous diseases",653,2,"A46-A46.0, A66-A67.3, A67.9, B07-B09, B35-B36.9, B85-B88.9, D86.3, E80.1-E80.29, I89.1-I89.8, L00-L23.2, L23.4-L27, L27.2-L54.8, L56, L56.2-L57.9, L59-L64, L64.8-L75.9, L77-L92.9, L94-L99.8, M72.5-M72.6, N49.2-N49.3, R20-R24.0","A46-A46.0, A66-A67.9, B07-B08.1, B35-B36.9, B85-B88.9, I89.1-I89.8, L00-L23.2, L23.4-L25.9, L28-L54.8, L56, L56.2-L57.9, L59-L64, L64.8-L75.9, L80-L92.9, L94-L99.8, M72.5-M72.6, N49.2-N49.3","035-035.9, 040.0, 078.0-078.19, 102-103.9, 110-111.9, 132-134.9, 136.1, 457.2-457.3, 680-709.3, 709.8-709.9, 728.86, 782-782.9, 785.4, V13.3, V19.4, V42.3, V43.83, V58.77, V59.1, V82.0","035-035.9, 040.0, 078.0-078.19, 102-111.9, 132-134.9, 136.1, 457.2-457.3, 680-709.3, 709.8-709.9, 728.86, 785.4","Non-communicable diseases","Skin and subcutaneous diseases","","","icd10","both_sexes","","","L29 Pruritus","truncated: true",NA,"Chapter XII Diseases of the skin and subcutaneous tissue | L20-L30 Dermatitis and eczema | L29 Pruritus",915,543,372,NA,NA,NA,"EUR",1,"",0,NA,NA,NA,NA,915,NA,NA,NA,NA,NA,419616,NA,NA,NA,NA,NA,-0.0041,NA,NA,NA,NA,NA,0.002,NA,NA,NA,NA,NA,-0.19,NA,NA,NA,NA,NA,0.0927,NA,NA,NA,NA,NA,-2.05,NA,NA,NA,NA,NA,0.982,NA,NA,NA,NA,NA,"h2_z_insignificant",NA,FALSE,"icd10-L29-both_sexes.tsv.bgz","icd10-L29-both_sexes.tsv.bgz.tbi","https://pan-ukb-us-east-1.s3.amazonaws.com/sumstats_flat_files/icd10-L29-both_sexes.tsv.bgz","https://pan-ukb-us-east-1.s3.amazonaws.com/sumstats_flat_files_tabix/icd10-L29-both_sexes.tsv.bgz.tbi","wget https://pan-ukb-us-east-1.s3.amazonaws.com/sumstats_flat_files/icd10-L29-both_sexes.tsv.bgz","wget https://pan-ukb-us-east-1.s3.amazonaws.com/sumstats_flat_files_tabix/icd10-L29-both_sexes.tsv.bgz.tbi","805cd57e152a50e7d0d4e28ad1074276",536769755,"182163f4b9c51784126ce87c4e0796c4",1750628,"HP_0000989","Pruritus","Other trait",915
