"Y54","Adverse effects of medical treatment",1,16,0.99999994,1.19209289550781e-07,0.99999994,1.19209289550781e-07,16,0.955882352941176,204,195,0,5.96046447753905e-08,4.28862688018054e-07,TRUE,TRUE,"adverse effects of medical treatment","Adverse effects of medical treatment",708,3,"D69.5-D69.59, D70.1-D70.2, D78-D78.89, D89.81-D89.813, E03.2, E06.4, E09-E09.9, E16.0, E23.1, E24.2, E27.3, E36-E36.8, E66.1, E87.0-E87.99, E89-E89.9, G21.0-G21.19, G24.0-G24.09, G25.1, G25.4, G25.6-G25.79, G62.0, G72.0, G93.7, G96.0, G96.11, G97-G97.9, H05.33-H05.339, H05.42-H05.53, H59-H59.89, H91.0-H91.09, H95-H95.9, I95.2-I95.81, I97-I97.9, J70-J70.4, J95-J95.9, K08.5-K08.59, K43-K43.9, K52.0, K62.7, K68.11, K91-K91.9, K94-K95.89, L23.3, L27.0-L27.1, L56.0-L56.1, L64.0, L76-L76.82, M10.2-M10.29, M87.1-M87.19, M96-M96.9, N14-N14.4, N30.4-N30.41, N46.021, N46.121, N52.2-N52.39, N65-N65.1, N99-N99.9, P93-P93.8, P96.2, P96.5, R50.2-R50.83, Y40-Y84.9, Y88-Y88.3, Z21.0, Z42-Z51.9, Z88-Z94.0, Z94.6-Z99.9","D69.5-D69.59, D70.1-D70.2, D75.82, D78-D78.89, D89.81-D89.813, E03.2, E06.4, E09-E09.9, E16.0, E23.1, E24.2, E27.3, E36-E36.8, E66.1, E71.43, E89-E89.9, G21.0-G25.79, G62.0-G97.9, H05.33-H05.339, H05.42-H05.53, H59-H59.89, H91.0-H91.09, H95-H95.9, I95.2-I97.9, J70-J70.4, J95-J95.9, K08.5-K08.59, K43-K43.9, K52.0, K62.7, K68.11, K91-K91.9, K94-K95.89, L23.3, L27.0-L27.1, L56.0-L56.1, L64.0, L76-L76.82, M10.2-M10.29, M87.1-M87.19, M96-M96.9, N14-N14.4, N30.4-N30.41, N46.021-N46.121, N52.2-N52.39, N65-N65.1, N99-N99.9, P93-P93.8, P96.2-P96.5, R50.2-R50.83, Y40-Y84.9, Y88-Y88.3, Z21.0, Z42-Z51.9, Z88-Z94.0, Z94.6-Z99.9","244.0-244.1, 244.3, 251.3, 253.7, 279.5-279.53, 331.81, 333.92, 349-349.9, 357.6, 359.24, 379.6-379.63, 440.3-440.32, 457.0, 458.2-458.29, 518.6-518.7, 519.0-519.1, 525.6-525.79, 526.62-526.63, 530.86-530.87, 536.4-536.49, 539-539.9, 551.2-551.29, 552.2-552.29, 553.2-553.29, 564.2-564.4, 569.6-569.8, 579.3, 595.82, 596.81-596.83, 598.2, 612-612.1, 779.4-779.5, 780.62-780.66, 995.89, E870-E876.9, E878-E879.9, E930-E949.9, V44-V45, V45.2-V45.4, V45.7, V45.77, V45.79-V45.8, V45.87-V45.89","244.0-244.1, 244.3, 251.3, 253.7, 279.5-279.53, 331.81, 333.92, 349-349.9, 357.6-359.24, 379.6-379.63, 440.3-440.32, 457.0, 458.2-458.29, 518.6-519.1, 525.6-525.79, 526.62-526.63, 530.86-530.87, 536.4-536.49, 539-539.9, 551.2-551.29, 552.2-552.29, 553.2-553.29, 564.2-564.4, 569.6-569.8, 579.3, 595.82, 596.81-596.83, 598.2, 612-612.1, 779.4-780.66, 995.89, E87.0-E87.99, E93.0-E94.99, V44-V45.89","Injuries","Unintentional injuries","Adverse effects of medical treatment","","icd10","both_sexes","","","Y54 Agents primarily affecting water-balance and mineral and uric acid metabolism","truncated: true",NA,"Chapter XX External causes of morbidity and mortality | Y40-Y59 Drugs, medicaments and biological substances causing adverse effects in therapeutic use | Y54 Agents primarily affecting water-balance and mineral and uric acid metabolism",388,184,204,NA,NA,NA,"EUR",1,"",0,NA,NA,NA,NA,388,NA,NA,NA,NA,NA,420143,NA,NA,NA,NA,NA,0.0043,NA,NA,NA,NA,NA,0.0021,NA,NA,NA,NA,NA,0.405,NA,NA,NA,NA,NA,0.198,NA,NA,NA,NA,NA,2.05,NA,NA,NA,NA,NA,1.01,NA,NA,NA,NA,NA,"h2_z_insignificant",NA,FALSE,"icd10-Y54-both_sexes.tsv.bgz","icd10-Y54-both_sexes.tsv.bgz.tbi","https://pan-ukb-us-east-1.s3.amazonaws.com/sumstats_flat_files/icd10-Y54-both_sexes.tsv.bgz","https://pan-ukb-us-east-1.s3.amazonaws.com/sumstats_flat_files_tabix/icd10-Y54-both_sexes.tsv.bgz.tbi","wget https://pan-ukb-us-east-1.s3.amazonaws.com/sumstats_flat_files/icd10-Y54-both_sexes.tsv.bgz","wget https://pan-ukb-us-east-1.s3.amazonaws.com/sumstats_flat_files_tabix/icd10-Y54-both_sexes.tsv.bgz.tbi","f7e4051971d6f92b8d3c4ad9e1c99b25",529080171,"e07925debb47b92136aaece8dd92314a",1750576,NA,NA,NA,388
"J94","Chronic respiratory diseases",1,16,0.916666627,9.5367431640625e-07,0.916666627,9.5367431640625e-07,16,1,204,204,0,4.76837158203125e-07,1.80342258551182e-06,TRUE,TRUE,"chronic respiratory diseases","Chronic respiratory diseases",508,2,"D86-D86.2, D86.9, G47.3-G47.39, J07-J08, J18.7, J19, J23-J35.9, J37-J68.9, J70.8-J84.9, J85.9, J87-J91, J91.8-J94.9, J96-J99.8, R05.0-R06.9, R08-R09.89, R84-R84.9, R91-R91.8","D86-D86.2, D86.9, J41-J65.0, J84-J84.9, J92.0-J92.0","135-135.9, 278.03, 327.2-327.29, 470, 470.9-474.9, 476-479, 491-508.9, 512-513, 514-518.53, 518.8-519, 519.11-519.9, 786-786.9, 793.1-793.2, 799.0-799.1, V07.1, V12.6-V12.60, V12.69, V13.81, V14-V15.09, V15.84, V17.5-V17.6, V19.6, V42.6, V43.81, V45.76, V58.74, V81.3-V81.4","135-135.9, 491-505.9, 515-516.9","Non-communicable diseases","Chronic respiratory diseases","","","icd10","both_sexes","","","J94 Other pleural conditions","truncated: true",NA,"Chapter X Diseases of the respiratory system | J90-J94 Other diseases of pleura | J94 Other pleural conditions",386,125,261,NA,NA,NA,"EUR",1,"",0,NA,NA,NA,NA,386,NA,NA,NA,NA,NA,420145,NA,NA,NA,NA,NA,-0.0021,NA,NA,NA,NA,NA,0.0021,NA,NA,NA,NA,NA,-0.199,NA,NA,NA,NA,NA,0.199,NA,NA,NA,NA,NA,-1,NA,NA,NA,NA,NA,0.98,NA,NA,NA,NA,NA,"h2_z_insignificant",NA,FALSE,"icd10-J94-both_sexes.tsv.bgz","icd10-J94-both_sexes.tsv.bgz.tbi","https://pan-ukb-us-east-1.s3.amazonaws.com/sumstats_flat_files/icd10-J94-both_sexes.tsv.bgz","https://pan-ukb-us-east-1.s3.amazonaws.com/sumstats_flat_files_tabix/icd10-J94-both_sexes.tsv.bgz.tbi","wget https://pan-ukb-us-east-1.s3.amazonaws.com/sumstats_flat_files/icd10-J94-both_sexes.tsv.bgz","wget https://pan-ukb-us-east-1.s3.amazonaws.com/sumstats_flat_files_tabix/icd10-J94-both_sexes.tsv.bgz.tbi","681764586f1ec55b3dd7232320dfd37b",528820880,"6a790ca9b3a1cbbe9f5220f904428fa2",1750366,NA,NA,NA,386
"D46","Other neoplasms",1,11,0.963636458,5.16176223754883e-05,0.383333296,0.042763472,16,0.965686275,204,197,0,2.58088111877442e-05,5.99496007904293e-05,TRUE,TRUE,"other neoplasms","Other neoplasms",490,3,"C75.90-C75.92, D00-D24.9, D26.0-D39.9, D4-D49.9, E34.0, K62.0-K62.3, K63.5, N60-N60.99, N84.0-N84.1, N87-N87.9","D00-D24.9, D26.0-D49.9, E34.0, K62.0-K62.1, K63.5, N60-N60.99, N84.0-N84.1, N87-N87.9","209.4-209.57, 209.61, 209.63-209.67, 210.0-217.8, 219-237.6, 237.70-237.72, 237.9-239.9, 569.0, 610-610.9, 622.1-622.2, 622.7","209.4-217.8, 219-237.6, 237.70-237.72, 237.9-239.9, 569.0, 610-610.9, 622.1-622.2, 622.7","Non-communicable diseases","Neoplasms","Other neoplasms","","icd10","both_sexes","","","D46 Myelodysplastic syndromes","truncated: true",NA,"Chapter II Neoplasms | D37-D48 Neoplasms of uncertain or unknown behaviour | D46 Myelodysplastic syndromes",380,152,228,NA,NA,NA,"EUR",1,"",0,NA,NA,NA,NA,380,NA,NA,NA,NA,NA,420151,NA,NA,NA,NA,NA,0.0028,NA,NA,NA,NA,NA,0.0023,NA,NA,NA,NA,NA,0.269,NA,NA,NA,NA,NA,0.221,NA,NA,NA,NA,NA,1.22,NA,NA,NA,NA,NA,0.999,NA,NA,NA,NA,NA,"h2_z_insignificant",NA,FALSE,"icd10-D46-both_sexes.tsv.bgz","icd10-D46-both_sexes.tsv.bgz.tbi","https://pan-ukb-us-east-1.s3.amazonaws.com/sumstats_flat_files/icd10-D46-both_sexes.tsv.bgz","https://pan-ukb-us-east-1.s3.amazonaws.com/sumstats_flat_files_tabix/icd10-D46-both_sexes.tsv.bgz.tbi","wget https://pan-ukb-us-east-1.s3.amazonaws.com/sumstats_flat_files/icd10-D46-both_sexes.tsv.bgz","wget https://pan-ukb-us-east-1.s3.amazonaws.com/sumstats_flat_files_tabix/icd10-D46-both_sexes.tsv.bgz.tbi","53ebbac70cc80fb979658984860db2bd",528914908,"6c6ed503c351ed7929484a39af2b5828",1750472,"EFO_0000198","myelodysplastic syndrome","Cancer",380
"F06","Alzheimer's disease and other dementias",1,16,0.974679351,2.38418579101562e-07,0.974679351,2.38418579101562e-07,13,1,204,204,0,1.19209289550781e-07,6.39395280317825e-07,TRUE,TRUE,"alzheimer's disease and other dementias","Alzheimer's disease and other dementias",543,3,"F00-F02.0, F02.8-F03.91, F06.2, G30-G31.1, G31.8-G32.89","F00-F02.0, F02.8-F06.2, G30-G31.1, G31.8-G32.89","290-290.9, 294.0-294.9, 331-331.2, 331.6-331.7, 331.82, 331.89-331.9","290-290.9, 294.0-294.9, 331-331.7, 331.82-331.9","Non-communicable diseases","Neurological disorders","Alzheimer's disease and other dementias","","icd10","both_sexes","","","F06 Other mental disorders due to brain damage and dysfunction and to physical disease","truncated: true",NA,"Chapter V Mental and behavioural disorders | F00-F09 Organic, including symptomatic, mental disorders | F06 Other mental disorders due to brain damage and dysfunction and to physical disease",379,168,211,NA,NA,NA,"EUR",1,"",0,NA,NA,NA,NA,379,NA,NA,NA,NA,NA,420152,NA,NA,NA,NA,NA,0.0024,NA,NA,NA,NA,NA,0.002,NA,NA,NA,NA,NA,0.231,NA,NA,NA,NA,NA,0.192,NA,NA,NA,NA,NA,1.2,NA,NA,NA,NA,NA,1.01,NA,NA,NA,NA,NA,"h2_z_insignificant",NA,FALSE,"icd10-F06-both_sexes.tsv.bgz","icd10-F06-both_sexes.tsv.bgz.tbi","https://pan-ukb-us-east-1.s3.amazonaws.com/sumstats_flat_files/icd10-F06-both_sexes.tsv.bgz","https://pan-ukb-us-east-1.s3.amazonaws.com/sumstats_flat_files_tabix/icd10-F06-both_sexes.tsv.bgz.tbi","wget https://pan-ukb-us-east-1.s3.amazonaws.com/sumstats_flat_files/icd10-F06-both_sexes.tsv.bgz","wget https://pan-ukb-us-east-1.s3.amazonaws.com/sumstats_flat_files_tabix/icd10-F06-both_sexes.tsv.bgz.tbi","eb09b13652499aa4c5f1d893583518c6",528785017,"6a1c1c7c02f02b0f0bf1010fa6f0304f",1750855,NA,NA,NA,379
"D26","Neoplasms",1,16,0.98333329,1.19209289550781e-07,0.98333329,1.19209289550781e-07,16,1,204,204,0,5.96046447753905e-08,4.28862688018054e-07,TRUE,TRUE,"neoplasms","Neoplasms",410,2,"C00-C45.9, C46.6, C47-C79.9, C8-D24.9, D26.0-D39.9, D4-D49.9, D54, E34.0, K62.0-K62.3, K63.5, N60-N60.99, N84.0-N84.1, N87-N87.9","C44.01-D24.9, D26.0-D49.9, E34.0, K62.0-K62.1, K63.5, N60-N60.99, N84.0-N84.1, N87-N87.9","140-175.9, 177-217.8, 219-237.6, 237.70-237.72, 237.9-239.9, 569.0, 610-610.9, 622.1-622.2, 622.7, V07.39, V10-V11, V13.22-V13.24, V16-V16.9, V42.4, V42.81-V42.82, V59.2-V59.3, V72.32, V76-V76.9","173.01-217.8, 219-237.6, 237.70-237.72, 237.9-239.9, 569.0, 610-610.9, 622.1-622.2, 622.7","Non-communicable diseases","Neoplasms","","","icd10","both_sexes","","","D26 Other benign neoplasms of uterus","truncated: true",NA,"Chapter II Neoplasms | D10-D36 Benign neoplasms | D26 Other benign neoplasms of uterus",377,377,0,NA,NA,NA,"EUR",1,"",0,NA,NA,NA,NA,377,NA,NA,NA,NA,NA,420154,NA,NA,NA,NA,NA,-0.0022,NA,NA,NA,NA,NA,0.0023,NA,NA,NA,NA,NA,-0.212,NA,NA,NA,NA,NA,0.222,NA,NA,NA,NA,NA,-0.957,NA,NA,NA,NA,NA,1.01,NA,NA,NA,NA,NA,"h2_z_insignificant",NA,FALSE,"icd10-D26-both_sexes.tsv.bgz","icd10-D26-both_sexes.tsv.bgz.tbi","https://pan-ukb-us-east-1.s3.amazonaws.com/sumstats_flat_files/icd10-D26-both_sexes.tsv.bgz","https://pan-ukb-us-east-1.s3.amazonaws.com/sumstats_flat_files_tabix/icd10-D26-both_sexes.tsv.bgz.tbi","wget https://pan-ukb-us-east-1.s3.amazonaws.com/sumstats_flat_files/icd10-D26-both_sexes.tsv.bgz","wget https://pan-ukb-us-east-1.s3.amazonaws.com/sumstats_flat_files_tabix/icd10-D26-both_sexes.tsv.bgz.tbi","ecc9ac28881a703d6545816627c09567",528686902,"9a12316353352415ea56959d0a6f2e93",1750481,"EFO_0003859","uterus neoplasm","Cancer",377
"B18","Acute hepatitis C",1,16,0.99999994,1.19209289550781e-07,0.99999994,1.19209289550781e-07,16,1,204,204,0,5.96046447753905e-08,4.28862688018054e-07,TRUE,TRUE,"acute hepatitis c","Acute hepatitis C",403,4,"B17.1-B17.11, B18.2, B19.2-B19.21","","070.41, 070.44, 070.51, 070.7-070.71","","Communicable, maternal, neonatal, and nutritional diseases","Other infectious diseases","Acute hepatitis","Acute hepatitis C","icd10","both_sexes","","","B18 Chronic viral hepatitis","truncated: true",NA,"Chapter I Certain infectious and parasitic diseases | B15-B19 Viral hepatitis | B18 Chronic viral hepatitis",375,118,257,NA,NA,NA,"EUR",1,"",0,NA,NA,NA,NA,375,NA,NA,NA,NA,NA,420156,NA,NA,NA,NA,NA,-0.003,NA,NA,NA,NA,NA,0.0019,NA,NA,NA,NA,NA,-0.291,NA,NA,NA,NA,NA,0.184,NA,NA,NA,NA,NA,-1.58,NA,NA,NA,NA,NA,1.05,NA,NA,NA,NA,NA,"h2_z_insignificant",NA,FALSE,"icd10-B18-both_sexes.tsv.bgz","icd10-B18-both_sexes.tsv.bgz.tbi","https://pan-ukb-us-east-1.s3.amazonaws.com/sumstats_flat_files/icd10-B18-both_sexes.tsv.bgz","https://pan-ukb-us-east-1.s3.amazonaws.com/sumstats_flat_files_tabix/icd10-B18-both_sexes.tsv.bgz.tbi","wget https://pan-ukb-us-east-1.s3.amazonaws.com/sumstats_flat_files/icd10-B18-both_sexes.tsv.bgz","wget https://pan-ukb-us-east-1.s3.amazonaws.com/sumstats_flat_files_tabix/icd10-B18-both_sexes.tsv.bgz.tbi","9e03df76a27a34d7a336cacc9dfae583",528315588,"c2421e3cb6fbdddf0c380cfba56fb382",1750616,"EFO_0007540","viral hepatitis","Other disease",375
"C49","Soft tissue and other extraosseous sarcomas",1,16,0.99999994,1.19209289550781e-07,0.99999994,1.19209289550781e-07,16,1,204,204,0,5.96046447753905e-08,4.28862688018054e-07,TRUE,TRUE,"soft tissue and other extraosseous sarcomas","Soft tissue and other extraosseous sarcomas",1011,3,"C49-C49.9","","171-171.9","","Non-communicable diseases","Neoplasms","Soft tissue and other extraosseous sarcomas","","icd10","both_sexes","","","C49 Malignant neoplasm of other connective and soft tissue","truncated: true",NA,"Chapter II Neoplasms | C45-C49 Malignant neoplasms of mesothelial and soft tissue | C49 Malignant neoplasm of other connective and soft tissue",374,172,202,NA,NA,NA,"EUR",1,"",0,NA,NA,NA,NA,374,NA,NA,NA,NA,NA,420157,NA,NA,NA,NA,NA,0.0016,NA,NA,NA,NA,NA,0.0021,NA,NA,NA,NA,NA,0.156,NA,NA,NA,NA,NA,0.204,NA,NA,NA,NA,NA,0.762,NA,NA,NA,NA,NA,0.994,NA,NA,NA,NA,NA,"h2_z_insignificant",NA,FALSE,"icd10-C49-both_sexes.tsv.bgz","icd10-C49-both_sexes.tsv.bgz.tbi","https://pan-ukb-us-east-1.s3.amazonaws.com/sumstats_flat_files/icd10-C49-both_sexes.tsv.bgz","https://pan-ukb-us-east-1.s3.amazonaws.com/sumstats_flat_files_tabix/icd10-C49-both_sexes.tsv.bgz.tbi","wget https://pan-ukb-us-east-1.s3.amazonaws.com/sumstats_flat_files/icd10-C49-both_sexes.tsv.bgz","wget https://pan-ukb-us-east-1.s3.amazonaws.com/sumstats_flat_files_tabix/icd10-C49-both_sexes.tsv.bgz.tbi","d69d8aece4697efb13cf3580aa8485bf",528837667,"e8ba76fd542c83382c4aba949eae27d1",1750532,"EFO_1000541",NA,NA,374
"M95","Musculoskeletal disorders",1,13,0.974359095,4.76837158203125e-06,0.699999928,0.000186324,16,1,204,204,0,2.38418579101562e-06,7.32640425364176e-06,TRUE,TRUE,"musculoskeletal disorders","Musculoskeletal disorders",626,2,"G54.2-G54.4, I27.1, L93-L93.2, M00-M10.19, M10.3-M25.9, M28-M32.9, M34-M49, M49.2-M59, M61-M72.4, M72.8-M73, M74-M79.676, M79.8-M87.09, M87.2-M89.59, M89.7-M95.9, M97-M99.9, N09","G54.2-G54.4, I27.1, L93-L93.2, M00-M10.19, M10.3-M25.9, M30-M48.58, M49.81-M54.5, M61-M72.4, M72.8-M87.09, M87.2-M95.9, M99-M99.9","274-274.9, 353.1-353.4, 416.1, 446-446.9, 710-710.2, 710.5-724.9, 726-727.9, 729-730.39, 730.7-739.9, V13.4-V13.59, V17.7-V17.89, V43.6-V43.8, V58.64-V58.65, V58.78, V77.5, V82.1-V82.2","274-274.9, 353.1-353.4, 416.1, 446-446.9, 710-727.9, 729-730.39, 730.7-739.9","Non-communicable diseases","Musculoskeletal disorders","","","icd10","both_sexes","","","M95 Other acquired deformities of musculoskeletal system and connective tissue","truncated: true",NA,"Chapter XIII Diseases of the musculoskeletal system and connective tissue | M95-M99 Other disorders of the musculoskeletal system and connective tissue | M95 Other acquired deformities of musculoskeletal system and connective tissue",365,177,188,NA,NA,NA,"EUR",1,"",0,NA,NA,NA,NA,365,NA,NA,NA,NA,NA,420166,NA,NA,NA,NA,NA,9e-04,NA,NA,NA,NA,NA,0.0019,NA,NA,NA,NA,NA,0.0893,NA,NA,NA,NA,NA,0.189,NA,NA,NA,NA,NA,0.474,NA,NA,NA,NA,NA,1.02,NA,NA,NA,NA,NA,"h2_z_insignificant",NA,FALSE,"icd10-M95-both_sexes.tsv.bgz","icd10-M95-both_sexes.tsv.bgz.tbi","https://pan-ukb-us-east-1.s3.amazonaws.com/sumstats_flat_files/icd10-M95-both_sexes.tsv.bgz","https://pan-ukb-us-east-1.s3.amazonaws.com/sumstats_flat_files_tabix/icd10-M95-both_sexes.tsv.bgz.tbi","wget https://pan-ukb-us-east-1.s3.amazonaws.com/sumstats_flat_files/icd10-M95-both_sexes.tsv.bgz","wget https://pan-ukb-us-east-1.s3.amazonaws.com/sumstats_flat_files_tabix/icd10-M95-both_sexes.tsv.bgz.tbi","5051ebd2de7175810ac13b30dad61019",528117169,"2733fe0de56bab5988ca742f75fd9ed6",1750572,"EFO_0009676,EFO_1001986","musculoskeletal system disease,connective tissue disease","Other disease",365
"D16","Neoplasms",1,16,0.98333329,1.19209289550781e-07,0.98333329,1.19209289550781e-07,16,1,204,204,0,5.96046447753905e-08,4.28862688018054e-07,TRUE,TRUE,"neoplasms","Neoplasms",410,2,"C00-C45.9, C46.6, C47-C79.9, C8-D24.9, D26.0-D39.9, D4-D49.9, D54, E34.0, K62.0-K62.3, K63.5, N60-N60.99, N84.0-N84.1, N87-N87.9","C44.01-D24.9, D26.0-D49.9, E34.0, K62.0-K62.1, K63.5, N60-N60.99, N84.0-N84.1, N87-N87.9","140-175.9, 177-217.8, 219-237.6, 237.70-237.72, 237.9-239.9, 569.0, 610-610.9, 622.1-622.2, 622.7, V07.39, V10-V11, V13.22-V13.24, V16-V16.9, V42.4, V42.81-V42.82, V59.2-V59.3, V72.32, V76-V76.9","173.01-217.8, 219-237.6, 237.70-237.72, 237.9-239.9, 569.0, 610-610.9, 622.1-622.2, 622.7","Non-communicable diseases","Neoplasms","","","icd10","both_sexes","","","D16 Benign neoplasm of bone and articular cartilage","truncated: true",NA,"Chapter II Neoplasms | D10-D36 Benign neoplasms | D16 Benign neoplasm of bone and articular cartilage",348,208,140,NA,NA,NA,"EUR",1,"",0,NA,NA,NA,NA,348,NA,NA,NA,NA,NA,420183,NA,NA,NA,NA,NA,0.0013,NA,NA,NA,NA,NA,0.0022,NA,NA,NA,NA,NA,0.134,NA,NA,NA,NA,NA,0.227,NA,NA,NA,NA,NA,0.591,NA,NA,NA,NA,NA,0.997,NA,NA,NA,NA,NA,"h2_z_insignificant",NA,FALSE,"icd10-D16-both_sexes.tsv.bgz","icd10-D16-both_sexes.tsv.bgz.tbi","https://pan-ukb-us-east-1.s3.amazonaws.com/sumstats_flat_files/icd10-D16-both_sexes.tsv.bgz","https://pan-ukb-us-east-1.s3.amazonaws.com/sumstats_flat_files_tabix/icd10-D16-both_sexes.tsv.bgz.tbi","wget https://pan-ukb-us-east-1.s3.amazonaws.com/sumstats_flat_files/icd10-D16-both_sexes.tsv.bgz","wget https://pan-ukb-us-east-1.s3.amazonaws.com/sumstats_flat_files_tabix/icd10-D16-both_sexes.tsv.bgz.tbi","e51c53ff78276ec3004768476f3c4cde",527981633,"3af4ed032cbfc6781e8a72e846f071df",1750604,"EFO_0003820","bone neoplasm","Cancer",348
"M94","Musculoskeletal disorders",1,13,0.974359095,4.76837158203125e-06,0.699999928,0.000186324,16,1,204,204,0,2.38418579101562e-06,7.32640425364176e-06,TRUE,TRUE,"musculoskeletal disorders","Musculoskeletal disorders",626,2,"G54.2-G54.4, I27.1, L93-L93.2, M00-M10.19, M10.3-M25.9, M28-M32.9, M34-M49, M49.2-M59, M61-M72.4, M72.8-M73, M74-M79.676, M79.8-M87.09, M87.2-M89.59, M89.7-M95.9, M97-M99.9, N09","G54.2-G54.4, I27.1, L93-L93.2, M00-M10.19, M10.3-M25.9, M30-M48.58, M49.81-M54.5, M61-M72.4, M72.8-M87.09, M87.2-M95.9, M99-M99.9","274-274.9, 353.1-353.4, 416.1, 446-446.9, 710-710.2, 710.5-724.9, 726-727.9, 729-730.39, 730.7-739.9, V13.4-V13.59, V17.7-V17.89, V43.6-V43.8, V58.64-V58.65, V58.78, V77.5, V82.1-V82.2","274-274.9, 353.1-353.4, 416.1, 446-446.9, 710-727.9, 729-730.39, 730.7-739.9","Non-communicable diseases","Musculoskeletal disorders","","","icd10","both_sexes","","","M94 Other disorders of cartilage","truncated: true",NA,"Chapter XIII Diseases of the musculoskeletal system and connective tissue | M91-M94 Chondropathies | M94 Other disorders of cartilage",347,220,127,NA,NA,NA,"EUR",1,"",0,NA,NA,NA,NA,347,NA,NA,NA,NA,NA,420184,NA,NA,NA,NA,NA,-0.0016,NA,NA,NA,NA,NA,0.0022,NA,NA,NA,NA,NA,-0.166,NA,NA,NA,NA,NA,0.228,NA,NA,NA,NA,NA,-0.727,NA,NA,NA,NA,NA,1,NA,NA,NA,NA,NA,"h2_z_insignificant",NA,FALSE,"icd10-M94-both_sexes.tsv.bgz","icd10-M94-both_sexes.tsv.bgz.tbi","https://pan-ukb-us-east-1.s3.amazonaws.com/sumstats_flat_files/icd10-M94-both_sexes.tsv.bgz","https://pan-ukb-us-east-1.s3.amazonaws.com/sumstats_flat_files_tabix/icd10-M94-both_sexes.tsv.bgz.tbi","wget https://pan-ukb-us-east-1.s3.amazonaws.com/sumstats_flat_files/icd10-M94-both_sexes.tsv.bgz","wget https://pan-ukb-us-east-1.s3.amazonaws.com/sumstats_flat_files_tabix/icd10-M94-both_sexes.tsv.bgz.tbi","d076c2b665e1f3e536578323cf18f386",527683354,"94c5d0d3893618c53d247e02f8c806a4",1750473,"EFO_0005802","cartilage disease","Other disease",347
"E06","Endocrine, metabolic, blood, and immune disorders",1,16,0.783333302,2.82526016235352e-05,0.783333302,2.82526016235352e-05,16,1,204,204,0,1.41263008117676e-05,3.56175960638585e-05,TRUE,TRUE,"endocrine, metabolic, blood, and immune disorders","Endocrine, metabolic, blood, and immune disorders",619,3,"C7A00-C7B8, D3A00-D3A8, D66-D69.49, D69.6-D70.0, D70.4-D77, D79-D85, D86.8, D86.82-D86.84, D86.86-D86.89, D87-D89.2, D89.8, D89.82-D99, E03-E03.1, E03.3-E06.3, E06.5-E07.9, E15-E16, E16.1-E23.0, E23.2-E24.1, E24.3, E24.8-E27.2, E27.4-E28.1, E28.3-E34, E34.1-E35.8, E37-E39, E47-E49., E62, E65-E66.09, E66.2-E80.09, E80.3-E85.9, E88-E88.9, E90-E998","D66-D69.49, D69.8-D70.0, D70.4-D75.81, D75.89-D77, D80-D84.9, D86.3-D86.89, D89-D89.8, D89.82-D89.9, E03-E03.1, E03.3-E06.3, E06.5-E07.9, E15-E16, E16.1-E23.0, E23.2-E24.1, E24.3-E27.2, E27.4-E28.1, E28.3-E34, E34.1-E35.8, E67-E71.42, E71.44-E88.9, E90-E99.9","240-244, 244.8-246.9, 251-251.2, 251.4-253.6, 253.8-256.39, 256.8-259.9, 270-273.9, 275-278.02, 278.1-279.49, 279.6-279.9, 286-289.9, 775.3, V12.2-V12.49, V18.1-V18.19, V45.86, V77.0, V77.3-V77.4, V77.6-V77.8, V77.91, V85-V85.45, V85.51, V85.53-V85.54","240-244, 244.8-246.9, 251-251.2, 251.4-253.6, 253.8-256.39, 256.8-259.9, 270-273.9, 275-279.49, 279.6-279.9, 286-289.9","Non-communicable diseases","Other non-communicable diseases","Endocrine, metabolic, blood, and immune disorders","","icd10","both_sexes","","","E06 Thyroiditis","truncated: true",NA,"Chapter IV Endocrine, nutritional and metabolic diseases | E00-E07 Disorders of thyroid gland | E06 Thyroiditis",344,304,40,NA,NA,NA,"EUR",1,"",0,NA,NA,NA,NA,344,NA,NA,NA,NA,NA,420187,NA,NA,NA,NA,NA,0.0037,NA,NA,NA,NA,NA,0.0022,NA,NA,NA,NA,NA,0.386,NA,NA,NA,NA,NA,0.229,NA,NA,NA,NA,NA,1.68,NA,NA,NA,NA,NA,0.979,NA,NA,NA,NA,NA,"h2_z_insignificant",NA,FALSE,"icd10-E06-both_sexes.tsv.bgz","icd10-E06-both_sexes.tsv.bgz.tbi","https://pan-ukb-us-east-1.s3.amazonaws.com/sumstats_flat_files/icd10-E06-both_sexes.tsv.bgz","https://pan-ukb-us-east-1.s3.amazonaws.com/sumstats_flat_files_tabix/icd10-E06-both_sexes.tsv.bgz.tbi","wget https://pan-ukb-us-east-1.s3.amazonaws.com/sumstats_flat_files/icd10-E06-both_sexes.tsv.bgz","wget https://pan-ukb-us-east-1.s3.amazonaws.com/sumstats_flat_files_tabix/icd10-E06-both_sexes.tsv.bgz.tbi","9fe41d3105d902bb72b32e866b791f65",527712136,"d2999bd7a2d40cf197c7cc50659fe923",1750685,"EFO_1000627","thyroid disease","Other disease",344
"M05","Musculoskeletal disorders",1,13,0.974359095,4.76837158203125e-06,0.699999928,0.000186324,16,1,204,204,0,2.38418579101562e-06,7.32640425364176e-06,TRUE,TRUE,"musculoskeletal disorders","Musculoskeletal disorders",626,2,"G54.2-G54.4, I27.1, L93-L93.2, M00-M10.19, M10.3-M25.9, M28-M32.9, M34-M49, M49.2-M59, M61-M72.4, M72.8-M73, M74-M79.676, M79.8-M87.09, M87.2-M89.59, M89.7-M95.9, M97-M99.9, N09","G54.2-G54.4, I27.1, L93-L93.2, M00-M10.19, M10.3-M25.9, M30-M48.58, M49.81-M54.5, M61-M72.4, M72.8-M87.09, M87.2-M95.9, M99-M99.9","274-274.9, 353.1-353.4, 416.1, 446-446.9, 710-710.2, 710.5-724.9, 726-727.9, 729-730.39, 730.7-739.9, V13.4-V13.59, V17.7-V17.89, V43.6-V43.8, V58.64-V58.65, V58.78, V77.5, V82.1-V82.2","274-274.9, 353.1-353.4, 416.1, 446-446.9, 710-727.9, 729-730.39, 730.7-739.9","Non-communicable diseases","Musculoskeletal disorders","","","icd10","both_sexes","","","M05 Seropositive rheumatoid arthritis","truncated: true",NA,"Chapter XIII Diseases of the musculoskeletal system and connective tissue | M05-M14 Inflammatory polyarthropathies | M05 Seropositive rheumatoid arthritis",344,245,99,NA,NA,NA,"EUR",1,"",0,NA,NA,NA,NA,344,NA,NA,NA,NA,NA,420187,NA,NA,NA,NA,NA,7e-04,NA,NA,NA,NA,NA,0.0021,NA,NA,NA,NA,NA,0.073,NA,NA,NA,NA,NA,0.219,NA,NA,NA,NA,NA,0.333,NA,NA,NA,NA,NA,0.983,NA,NA,NA,NA,NA,"h2_z_insignificant",NA,FALSE,"icd10-M05-both_sexes.tsv.bgz","icd10-M05-both_sexes.tsv.bgz.tbi","https://pan-ukb-us-east-1.s3.amazonaws.com/sumstats_flat_files/icd10-M05-both_sexes.tsv.bgz","https://pan-ukb-us-east-1.s3.amazonaws.com/sumstats_flat_files_tabix/icd10-M05-both_sexes.tsv.bgz.tbi","wget https://pan-ukb-us-east-1.s3.amazonaws.com/sumstats_flat_files/icd10-M05-both_sexes.tsv.bgz","wget https://pan-ukb-us-east-1.s3.amazonaws.com/sumstats_flat_files_tabix/icd10-M05-both_sexes.tsv.bgz.tbi","5edd31934fdf487843dd5ac4d6e629f9",527700873,"7a8a88544732f0ac8a0e7484e4bed082",1749836,"EFO_0000685","rheumatoid arthritis","Immune system disorder",344
