"K51","Digestive diseases",1,12,0.969696879,1.56164169311523e-05,0.633333266,0.000733614,16,1,204,204,0,7.80820846557615e-06,2.17303914843865e-05,TRUE,TRUE,"digestive diseases","Digestive diseases",526,2,"I84-I85.9, I98.2, K15.9-K42.9, K44-K52, K52.2-K62, K62.4-K62.6, K62.8-K63.4, K63.8-K67, K67.8-K68.1, K68.12-K75, K75.2, K75.4-K76.2, K76.4-K90.9, K92-K93, K93.8, K96-K99, N29.0, N49.5, R11-R19.8, R85-R85.9, Z52.6, Z94.4","I84-I85.9, I98.2-I98.2, K20-K42.9, K44-K52, K52.2-K62, K62.4-K62.6, K62.8-K63.4, K63.8-K67, K67.8-K68.1, K68.12-K90.9, K92-K92.9, K93.8, R12-R18.9, R85-R85.9, Z52.6, Z94.4","455-455.9, 456.0-456.21, 530-530.85, 530.89-536.3, 536.8-538, 540-543.9, 550-551.1, 551.3-552.1, 552.3-553.1, 553.3-558.9, 560-560.39, 560.8-562.13, 564-564.1, 564.5-569, 569.1-569.5, 569.81-572, 572.2-579.2, 579.4-579.9, 784-784.99, 787-787.99, 789.9, 792.1-792.4, V12.7-V12.79, V18.5-V18.59, V42.7, V45.72, V45.75, V47.3, V58.75, V59.6","455-456.21, 530-530.85, 530.89-536.3, 536.8-538, 540-551.1, 551.3-552.1, 552.3-553.1, 553.3-564.1, 564.5-569, 569.1-569.5, 569.81-579.2, 579.4-579.9, 787.1-792.4, V42.7, V59.6","Non-communicable diseases","Digestive diseases","","","icd10","both_sexes","","","K51 Ulcerative colitis","truncated: true",NA,"Chapter XI Diseases of the digestive system | K50-K52 Noninfective enteritis and colitis | K51 Ulcerative colitis",3740,1774,1966,NA,NA,NA,"CSA,EUR",2,"",0,NA,NA,113,NA,3627,NA,NA,NA,8763,NA,416904,NA,NA,NA,0.111,NA,0.0055,NA,NA,NA,0.0442,NA,0.0026,NA,NA,NA,1.3,NA,0.0858,NA,NA,NA,0.514,NA,0.0405,NA,NA,NA,2.52,NA,2.12,NA,NA,NA,1.01,NA,1.04,NA,NA,NA,"h2_z_insignificant",NA,"h2_z_insignificant",NA,FALSE,"icd10-K51-both_sexes.tsv.bgz","icd10-K51-both_sexes.tsv.bgz.tbi","https://pan-ukb-us-east-1.s3.amazonaws.com/sumstats_flat_files/icd10-K51-both_sexes.tsv.bgz","https://pan-ukb-us-east-1.s3.amazonaws.com/sumstats_flat_files_tabix/icd10-K51-both_sexes.tsv.bgz.tbi","wget https://pan-ukb-us-east-1.s3.amazonaws.com/sumstats_flat_files/icd10-K51-both_sexes.tsv.bgz","wget https://pan-ukb-us-east-1.s3.amazonaws.com/sumstats_flat_files_tabix/icd10-K51-both_sexes.tsv.bgz.tbi","6c7a79ff2a98dfd41ac99e926f6e8f9d",1111505943,"2cf81696541afeac3001ef8a35a7b9ed",1929435,"EFO_0000729","ulcerative colitis","Immune system disorder",3740
"I67","Ischemic stroke",1,16,0.99999994,1.19209289550781e-07,0.99999994,1.19209289550781e-07,16,1,204,204,0,5.96046447753905e-08,4.28862688018054e-07,TRUE,TRUE,"ischemic stroke","Ischemic stroke",495,4,"G45-G46.8, I63-I63.9, I65-I66.9, I67.2-I67.848, I69.3-I69.4","I63-I63.9","433-435.9, 437.0-437.2, 437.4-437.9","434-434.91","Non-communicable diseases","Cardiovascular diseases","Stroke","Ischemic stroke","icd10","both_sexes","","","I67 Other cerebrovascular diseases","truncated: true",NA,"Chapter IX Diseases of the circulatory system | I60-I69 Cerebrovascular diseases | I67 Other cerebrovascular diseases",3646,1613,2033,NA,NA,NA,"AFR,CSA,EUR",3,"",0,96,NA,82,NA,3468,NA,6540,NA,8794,NA,417063,NA,0.136,NA,0.134,NA,0.0021,NA,0.0994,NA,0.0373,NA,0.0021,NA,1.44,NA,1.98,NA,0.0339,NA,1.05,NA,0.551,NA,0.0339,NA,1.37,NA,3.59,NA,1,NA,0.988,NA,1,NA,1.03,NA,"h2_z_insignificant",NA,"h2_z_insignificant",NA,"h2_z_insignificant",NA,FALSE,"icd10-I67-both_sexes.tsv.bgz","icd10-I67-both_sexes.tsv.bgz.tbi","https://pan-ukb-us-east-1.s3.amazonaws.com/sumstats_flat_files/icd10-I67-both_sexes.tsv.bgz","https://pan-ukb-us-east-1.s3.amazonaws.com/sumstats_flat_files_tabix/icd10-I67-both_sexes.tsv.bgz.tbi","wget https://pan-ukb-us-east-1.s3.amazonaws.com/sumstats_flat_files/icd10-I67-both_sexes.tsv.bgz","wget https://pan-ukb-us-east-1.s3.amazonaws.com/sumstats_flat_files_tabix/icd10-I67-both_sexes.tsv.bgz.tbi","3c4f335a2e5ff4dfc687413f80a22c3f",1583358307,"0dbea94a5741048c6efbea65d5d6dd28",2046782,"EFO_0003763","cerebrovascular disorder","Cardiovascular disease",3646
"R20","Skin and subcutaneous diseases",1,16,0.933333278,5.96046447753906e-07,0.933333278,5.96046447753906e-07,16,1,204,204,0,2.98023223876953e-07,1.31219180662241e-06,TRUE,TRUE,"skin and subcutaneous diseases","Skin and subcutaneous diseases",653,2,"A46-A46.0, A66-A67.3, A67.9, B07-B09, B35-B36.9, B85-B88.9, D86.3, E80.1-E80.29, I89.1-I89.8, L00-L23.2, L23.4-L27, L27.2-L54.8, L56, L56.2-L57.9, L59-L64, L64.8-L75.9, L77-L92.9, L94-L99.8, M72.5-M72.6, N49.2-N49.3, R20-R24.0","A46-A46.0, A66-A67.9, B07-B08.1, B35-B36.9, B85-B88.9, I89.1-I89.8, L00-L23.2, L23.4-L25.9, L28-L54.8, L56, L56.2-L57.9, L59-L64, L64.8-L75.9, L80-L92.9, L94-L99.8, M72.5-M72.6, N49.2-N49.3","035-035.9, 040.0, 078.0-078.19, 102-103.9, 110-111.9, 132-134.9, 136.1, 457.2-457.3, 680-709.3, 709.8-709.9, 728.86, 782-782.9, 785.4, V13.3, V19.4, V42.3, V43.83, V58.77, V59.1, V82.0","035-035.9, 040.0, 078.0-078.19, 102-111.9, 132-134.9, 136.1, 457.2-457.3, 680-709.3, 709.8-709.9, 728.86, 785.4","Non-communicable diseases","Skin and subcutaneous diseases","","","icd10","both_sexes","","","R20 Disturbances of skin sensation","truncated: true",NA,"Chapter XVIII Symptoms, signs and abnormal clinical and laboratory findings, not elsewhere classified | R20-R23 Symptoms and signs involving the skin and subcutaneous tissue | R20 Disturbances of skin sensation",3614,2008,1606,NA,NA,NA,"AFR,CSA,EUR",3,"",0,79,NA,86,NA,3449,NA,6557,NA,8790,NA,417082,NA,0.531,NA,0.168,NA,3e-04,NA,0.0978,NA,0.0428,NA,0.0022,NA,6.49,NA,2.4,NA,0.00486,NA,1.2,NA,0.611,NA,0.0357,NA,5.43,NA,3.93,NA,0.136,NA,0.998,NA,1.03,NA,1.03,NA,"not_EUR_plus_1",NA,"h2_z_insignificant",NA,"h2_z_insignificant",NA,FALSE,"icd10-R20-both_sexes.tsv.bgz","icd10-R20-both_sexes.tsv.bgz.tbi","https://pan-ukb-us-east-1.s3.amazonaws.com/sumstats_flat_files/icd10-R20-both_sexes.tsv.bgz","https://pan-ukb-us-east-1.s3.amazonaws.com/sumstats_flat_files_tabix/icd10-R20-both_sexes.tsv.bgz.tbi","wget https://pan-ukb-us-east-1.s3.amazonaws.com/sumstats_flat_files/icd10-R20-both_sexes.tsv.bgz","wget https://pan-ukb-us-east-1.s3.amazonaws.com/sumstats_flat_files_tabix/icd10-R20-both_sexes.tsv.bgz.tbi","b7d28dbcfbc3fe93f76f5bbc75a4b33d",1574747860,"4c576d30127cb3b51a0893f3b60bbe89",2044992,"EFO_0009522","disturbance of skin sensation","Neurological disorder",3614
"J33","Chronic respiratory diseases",1,16,0.916666627,9.5367431640625e-07,0.916666627,9.5367431640625e-07,16,1,204,204,0,4.76837158203125e-07,1.80342258551182e-06,TRUE,TRUE,"chronic respiratory diseases","Chronic respiratory diseases",508,2,"D86-D86.2, D86.9, G47.3-G47.39, J07-J08, J18.7, J19, J23-J35.9, J37-J68.9, J70.8-J84.9, J85.9, J87-J91, J91.8-J94.9, J96-J99.8, R05.0-R06.9, R08-R09.89, R84-R84.9, R91-R91.8","D86-D86.2, D86.9, J41-J65.0, J84-J84.9, J92.0-J92.0","135-135.9, 278.03, 327.2-327.29, 470, 470.9-474.9, 476-479, 491-508.9, 512-513, 514-518.53, 518.8-519, 519.11-519.9, 786-786.9, 793.1-793.2, 799.0-799.1, V07.1, V12.6-V12.60, V12.69, V13.81, V14-V15.09, V15.84, V17.5-V17.6, V19.6, V42.6, V43.81, V45.76, V58.74, V81.3-V81.4","135-135.9, 491-505.9, 515-516.9","Non-communicable diseases","Chronic respiratory diseases","","","icd10","both_sexes","","","J33 Nasal polyp","truncated: true",NA,"Chapter X Diseases of the respiratory system | J30-J39 Other diseases of upper respiratory tract | J33 Nasal polyp",3610,1180,2430,NA,NA,NA,"CSA,EUR",2,"",0,NA,NA,59,NA,3551,NA,NA,NA,8817,NA,416980,NA,NA,NA,0.125,NA,0.0115,NA,NA,NA,0.0437,NA,0.0025,NA,NA,NA,2.37,NA,0.182,NA,NA,NA,0.832,NA,0.0396,NA,NA,NA,2.85,NA,4.6,NA,NA,NA,1,NA,1.05,NA,NA,NA,"h2_z_insignificant",NA,"not_EUR_plus_1",NA,FALSE,"icd10-J33-both_sexes.tsv.bgz","icd10-J33-both_sexes.tsv.bgz.tbi","https://pan-ukb-us-east-1.s3.amazonaws.com/sumstats_flat_files/icd10-J33-both_sexes.tsv.bgz","https://pan-ukb-us-east-1.s3.amazonaws.com/sumstats_flat_files_tabix/icd10-J33-both_sexes.tsv.bgz.tbi","wget https://pan-ukb-us-east-1.s3.amazonaws.com/sumstats_flat_files/icd10-J33-both_sexes.tsv.bgz","wget https://pan-ukb-us-east-1.s3.amazonaws.com/sumstats_flat_files_tabix/icd10-J33-both_sexes.tsv.bgz.tbi","bfabedb2e3de6d74ab66102a3cc5a762",1100173258,"830238e98bee58c62899adca6f868a5e",1928132,"EFO_1000391","Nasal cavity polyp","Other disease",3610
"I49","Cardiovascular diseases",1,16,0.98333329,1.19209289550781e-07,0.98333329,1.19209289550781e-07,16,1,204,204,0,5.96046447753905e-08,4.28862688018054e-07,TRUE,TRUE,"cardiovascular diseases","Cardiovascular diseases",491,2,"B33.2-B33.24, D86.85, G45-G46.8, I00.0-I01.9, I02.0, I03-I11.9, I14-I27.0, I27.2-I83.93, I86-I89.0, I89.9-I95.1, I98, I98.4-ID5.9, K75.1, R00-R01.2, R07-R07.9","A32.82, B33.2-B33.24, B37.6, I01-I09.9, I20-I27.0, I33-I73.9","074.2, 074.21-074.23, 391-391.9, 392.0, 393-398.99, 402-402.91, 410-416.0, 417-417.9, 420-425.5, 425.7-440.29, 440.4-445.89, 447-454.9, 456, 456.3-457, 457.1, 457.8-458.1, 459-459.9, 785-785.3, V12.5-V12.59, V15.1, V17.1, V17.3-V17.49, V42.1-V42.2, V43.2-V43.5, V45.0-V45.09, V45.81-V45.82, V47.2, V58.61, V58.63, V58.66, V58.73, V81-V81.2","074.2-074.23, 112.81-115.94, 391-398.99, 410-416.0, 421-440.29, 440.4-443.9","Non-communicable diseases","Cardiovascular diseases","","","icd10","both_sexes","","","I49 Other cardiac arrhythmias","truncated: true",NA,"Chapter IX Diseases of the circulatory system | I30-I52 Other forms of heart disease | I49 Other cardiac arrhythmias",3596,1476,2119,NA,NA,NA,"CSA,EUR",2,"",0,NA,NA,66,NA,3530,NA,NA,NA,8810,NA,417001,NA,NA,NA,0.0243,NA,0.004,NA,NA,NA,0.0388,NA,0.0024,NA,NA,NA,0.425,NA,0.0637,NA,NA,NA,0.678,NA,0.0382,NA,NA,NA,0.627,NA,1.67,NA,NA,NA,1.01,NA,1.03,NA,NA,NA,"h2_z_insignificant",NA,"h2_z_insignificant",NA,FALSE,"icd10-I49-both_sexes.tsv.bgz","icd10-I49-both_sexes.tsv.bgz.tbi","https://pan-ukb-us-east-1.s3.amazonaws.com/sumstats_flat_files/icd10-I49-both_sexes.tsv.bgz","https://pan-ukb-us-east-1.s3.amazonaws.com/sumstats_flat_files_tabix/icd10-I49-both_sexes.tsv.bgz.tbi","wget https://pan-ukb-us-east-1.s3.amazonaws.com/sumstats_flat_files/icd10-I49-both_sexes.tsv.bgz","wget https://pan-ukb-us-east-1.s3.amazonaws.com/sumstats_flat_files_tabix/icd10-I49-both_sexes.tsv.bgz.tbi","e529339036e4df41d51fb97f4e320cb1",1101497119,"e2d5d00d51782c209c9daf7fd3df86ae",1928232,"EFO_0004269","cardiac arrhythmia","Cardiovascular disease",3596
"N30","Adverse effects of medical treatment",1,16,0.99999994,1.19209289550781e-07,0.99999994,1.19209289550781e-07,16,0.955882352941176,204,195,0,5.96046447753905e-08,4.28862688018054e-07,TRUE,TRUE,"adverse effects of medical treatment","Adverse effects of medical treatment",708,3,"D69.5-D69.59, D70.1-D70.2, D78-D78.89, D89.81-D89.813, E03.2, E06.4, E09-E09.9, E16.0, E23.1, E24.2, E27.3, E36-E36.8, E66.1, E87.0-E87.99, E89-E89.9, G21.0-G21.19, G24.0-G24.09, G25.1, G25.4, G25.6-G25.79, G62.0, G72.0, G93.7, G96.0, G96.11, G97-G97.9, H05.33-H05.339, H05.42-H05.53, H59-H59.89, H91.0-H91.09, H95-H95.9, I95.2-I95.81, I97-I97.9, J70-J70.4, J95-J95.9, K08.5-K08.59, K43-K43.9, K52.0, K62.7, K68.11, K91-K91.9, K94-K95.89, L23.3, L27.0-L27.1, L56.0-L56.1, L64.0, L76-L76.82, M10.2-M10.29, M87.1-M87.19, M96-M96.9, N14-N14.4, N30.4-N30.41, N46.021, N46.121, N52.2-N52.39, N65-N65.1, N99-N99.9, P93-P93.8, P96.2, P96.5, R50.2-R50.83, Y40-Y84.9, Y88-Y88.3, Z21.0, Z42-Z51.9, Z88-Z94.0, Z94.6-Z99.9","D69.5-D69.59, D70.1-D70.2, D75.82, D78-D78.89, D89.81-D89.813, E03.2, E06.4, E09-E09.9, E16.0, E23.1, E24.2, E27.3, E36-E36.8, E66.1, E71.43, E89-E89.9, G21.0-G25.79, G62.0-G97.9, H05.33-H05.339, H05.42-H05.53, H59-H59.89, H91.0-H91.09, H95-H95.9, I95.2-I97.9, J70-J70.4, J95-J95.9, K08.5-K08.59, K43-K43.9, K52.0, K62.7, K68.11, K91-K91.9, K94-K95.89, L23.3, L27.0-L27.1, L56.0-L56.1, L64.0, L76-L76.82, M10.2-M10.29, M87.1-M87.19, M96-M96.9, N14-N14.4, N30.4-N30.41, N46.021-N46.121, N52.2-N52.39, N65-N65.1, N99-N99.9, P93-P93.8, P96.2-P96.5, R50.2-R50.83, Y40-Y84.9, Y88-Y88.3, Z21.0, Z42-Z51.9, Z88-Z94.0, Z94.6-Z99.9","244.0-244.1, 244.3, 251.3, 253.7, 279.5-279.53, 331.81, 333.92, 349-349.9, 357.6, 359.24, 379.6-379.63, 440.3-440.32, 457.0, 458.2-458.29, 518.6-518.7, 519.0-519.1, 525.6-525.79, 526.62-526.63, 530.86-530.87, 536.4-536.49, 539-539.9, 551.2-551.29, 552.2-552.29, 553.2-553.29, 564.2-564.4, 569.6-569.8, 579.3, 595.82, 596.81-596.83, 598.2, 612-612.1, 779.4-779.5, 780.62-780.66, 995.89, E870-E876.9, E878-E879.9, E930-E949.9, V44-V45, V45.2-V45.4, V45.7, V45.77, V45.79-V45.8, V45.87-V45.89","244.0-244.1, 244.3, 251.3, 253.7, 279.5-279.53, 331.81, 333.92, 349-349.9, 357.6-359.24, 379.6-379.63, 440.3-440.32, 457.0, 458.2-458.29, 518.6-519.1, 525.6-525.79, 526.62-526.63, 530.86-530.87, 536.4-536.49, 539-539.9, 551.2-551.29, 552.2-552.29, 553.2-553.29, 564.2-564.4, 569.6-569.8, 579.3, 595.82, 596.81-596.83, 598.2, 612-612.1, 779.4-780.66, 995.89, E87.0-E87.99, E93.0-E94.99, V44-V45.89","Injuries","Unintentional injuries","Adverse effects of medical treatment","","icd10","both_sexes","","","N30 Cystitis","truncated: true",NA,"Chapter XIV Diseases of the genitourinary system | N30-N39 Other diseases of urinary system | N30 Cystitis",3584,2229,1355,NA,NA,NA,"AFR,CSA,EUR",3,"",0,56,NA,55,NA,3473,NA,6580,NA,8821,NA,417058,NA,0.255,NA,0.133,NA,2e-04,NA,0.0755,NA,0.047,NA,0.002,NA,4.05,NA,2.67,NA,0.00322,NA,1.2,NA,0.945,NA,0.0322,NA,3.38,NA,2.83,NA,0.1,NA,1.02,NA,1,NA,1.01,NA,"h2_z_insignificant",NA,"h2_z_insignificant",NA,"h2_z_insignificant",NA,FALSE,"icd10-N30-both_sexes.tsv.bgz","icd10-N30-both_sexes.tsv.bgz.tbi","https://pan-ukb-us-east-1.s3.amazonaws.com/sumstats_flat_files/icd10-N30-both_sexes.tsv.bgz","https://pan-ukb-us-east-1.s3.amazonaws.com/sumstats_flat_files_tabix/icd10-N30-both_sexes.tsv.bgz.tbi","wget https://pan-ukb-us-east-1.s3.amazonaws.com/sumstats_flat_files/icd10-N30-both_sexes.tsv.bgz","wget https://pan-ukb-us-east-1.s3.amazonaws.com/sumstats_flat_files_tabix/icd10-N30-both_sexes.tsv.bgz.tbi","d086e582b2d4e6f73aa4a9617836867d",1557070399,"efe3586036fa96c45385bb9c0a71a5ff",2042213,"EFO_1000025","cystitis","Other disease",3584
"I35","Non-rheumatic valvular heart disease",1,11,1.000000119,2.62260437011719e-05,0.633333266,0.000733614,16,1,204,204,0,1.31130218505859e-05,3.3637751703677e-05,TRUE,TRUE,"non-rheumatic valvular heart disease","Non-rheumatic valvular heart disease",504,3,"I34-I37.9","I34-I37.9","424.0-424.3","424.0-424.3","Non-communicable diseases","Cardiovascular diseases","Non-rheumatic valvular heart disease","","icd10","both_sexes","","","I35 Nonrheumatic aortic valve disorders","truncated: true",NA,"Chapter IX Diseases of the circulatory system | I30-I52 Other forms of heart disease | I35 Nonrheumatic aortic valve disorders",3552,1281,2271,NA,NA,NA,"CSA,EUR",2,"",0,NA,NA,73,NA,3479,NA,NA,NA,8803,NA,417052,NA,NA,NA,0.0556,NA,0.0083,NA,NA,NA,0.0374,NA,0.0022,NA,NA,NA,0.9,NA,0.134,NA,NA,NA,0.605,NA,0.0354,NA,NA,NA,1.49,NA,3.77,NA,NA,NA,1.01,NA,1.03,NA,NA,NA,"h2_z_insignificant",NA,"h2_z_insignificant",NA,FALSE,"icd10-I35-both_sexes.tsv.bgz","icd10-I35-both_sexes.tsv.bgz.tbi","https://pan-ukb-us-east-1.s3.amazonaws.com/sumstats_flat_files/icd10-I35-both_sexes.tsv.bgz","https://pan-ukb-us-east-1.s3.amazonaws.com/sumstats_flat_files_tabix/icd10-I35-both_sexes.tsv.bgz.tbi","wget https://pan-ukb-us-east-1.s3.amazonaws.com/sumstats_flat_files/icd10-I35-both_sexes.tsv.bgz","wget https://pan-ukb-us-east-1.s3.amazonaws.com/sumstats_flat_files_tabix/icd10-I35-both_sexes.tsv.bgz.tbi","bee3c379c2c7e1c68891190431477751",1102981837,"47b0abc216e66c64101b452d5a738046",1928110,"EFO_0009531","aortic valve disease","Cardiovascular disease",3552
"E10","Diabetes mellitus",1,9,0.944444418,0.000580668,-0.083333328,0.685328603,16,0.995098039215686,204,203,0,0.000290334,0.000594782,TRUE,TRUE,"diabetes mellitus","Diabetes mellitus",587,3,"E08-E08.11, E08.3-E08.9, E10-E10.11, E10.3-E11.1, E11.3-E12.1, E12.3-E13.11, E13.3-E14.1, E14.3-E14.9, R73-R73.9","E08-E08.11, E08.3-E08.9, E10-E10.11, E10.3-E11.1, E11.3-E12.1, E12.3-E13.11, E13.3-E14.1, E14.3-E14.9","249-249.31, 249.5-250.39, 250.5-250.99, 362.0-362.07, 790.2-790.29, V18-V18.0, V42.83, V45.85, V58.67, V77.1","249-249.31, 249.5-250.39, 250.5-250.99, 362.0-362.07","Non-communicable diseases","Diabetes and kidney diseases","Diabetes mellitus","","icd10","both_sexes","","","E10 Insulin-dependent diabetes mellitus","truncated: true",NA,"Chapter IV Endocrine, nutritional and metabolic diseases | E10-E14 Diabetes mellitus | E10 Insulin-dependent diabetes mellitus",3541,1485,2056,NA,NA,NA,"AFR,CSA,EUR",3,"",0,122,NA,173,NA,3246,NA,6514,NA,8703,NA,417285,NA,0.103,NA,0.0605,NA,0.0077,NA,0.0904,NA,0.04,NA,0.0034,NA,0.913,NA,0.515,NA,0.131,NA,0.803,NA,0.341,NA,0.0577,NA,1.14,NA,1.51,NA,2.26,NA,0.995,NA,1.02,NA,1.06,NA,"h2_z_insignificant",NA,"h2_z_insignificant",NA,"h2_z_insignificant",NA,FALSE,"icd10-E10-both_sexes.tsv.bgz","icd10-E10-both_sexes.tsv.bgz.tbi","https://pan-ukb-us-east-1.s3.amazonaws.com/sumstats_flat_files/icd10-E10-both_sexes.tsv.bgz","https://pan-ukb-us-east-1.s3.amazonaws.com/sumstats_flat_files_tabix/icd10-E10-both_sexes.tsv.bgz.tbi","wget https://pan-ukb-us-east-1.s3.amazonaws.com/sumstats_flat_files/icd10-E10-both_sexes.tsv.bgz","wget https://pan-ukb-us-east-1.s3.amazonaws.com/sumstats_flat_files_tabix/icd10-E10-both_sexes.tsv.bgz.tbi","2e80b00ddc737e8d6300dcfe88419364",1599420429,"e60ff12d8471f6565cedd3e27c8783ab",2048314,"MONDO_0005147","type 1 diabetes mellitus","Immune system disorder",3541
"M06","Musculoskeletal disorders",1,13,0.974359095,4.76837158203125e-06,0.699999928,0.000186324,16,1,204,204,0,2.38418579101562e-06,7.32640425364176e-06,TRUE,TRUE,"musculoskeletal disorders","Musculoskeletal disorders",626,2,"G54.2-G54.4, I27.1, L93-L93.2, M00-M10.19, M10.3-M25.9, M28-M32.9, M34-M49, M49.2-M59, M61-M72.4, M72.8-M73, M74-M79.676, M79.8-M87.09, M87.2-M89.59, M89.7-M95.9, M97-M99.9, N09","G54.2-G54.4, I27.1, L93-L93.2, M00-M10.19, M10.3-M25.9, M30-M48.58, M49.81-M54.5, M61-M72.4, M72.8-M87.09, M87.2-M95.9, M99-M99.9","274-274.9, 353.1-353.4, 416.1, 446-446.9, 710-710.2, 710.5-724.9, 726-727.9, 729-730.39, 730.7-739.9, V13.4-V13.59, V17.7-V17.89, V43.6-V43.8, V58.64-V58.65, V58.78, V77.5, V82.1-V82.2","274-274.9, 353.1-353.4, 416.1, 446-446.9, 710-727.9, 729-730.39, 730.7-739.9","Non-communicable diseases","Musculoskeletal disorders","","","icd10","both_sexes","","","M06 Other rheumatoid arthritis","truncated: true",NA,"Chapter XIII Diseases of the musculoskeletal system and connective tissue | M05-M14 Inflammatory polyarthropathies | M06 Other rheumatoid arthritis",3475,2442,1033,NA,NA,NA,"AFR,CSA,EUR",3,"",0,54,NA,97,NA,3324,NA,6582,NA,8779,NA,417207,NA,0.0636,NA,0.151,NA,0.0073,NA,0.0777,NA,0.0411,NA,0.0024,NA,1.04,NA,1.96,NA,0.122,NA,1.27,NA,0.536,NA,0.04,NA,0.817,NA,3.67,NA,3.04,NA,0.989,NA,1.02,NA,1.06,NA,"h2_z_insignificant",NA,"h2_z_insignificant",NA,"h2_z_insignificant",NA,FALSE,"icd10-M06-both_sexes.tsv.bgz","icd10-M06-both_sexes.tsv.bgz.tbi","https://pan-ukb-us-east-1.s3.amazonaws.com/sumstats_flat_files/icd10-M06-both_sexes.tsv.bgz","https://pan-ukb-us-east-1.s3.amazonaws.com/sumstats_flat_files_tabix/icd10-M06-both_sexes.tsv.bgz.tbi","wget https://pan-ukb-us-east-1.s3.amazonaws.com/sumstats_flat_files/icd10-M06-both_sexes.tsv.bgz","wget https://pan-ukb-us-east-1.s3.amazonaws.com/sumstats_flat_files_tabix/icd10-M06-both_sexes.tsv.bgz.tbi","a7af17e598d62e7a61f7b29a539faa56",1561336813,"3aabf1f6dd53ac8ff386cf9acced6c65",2042003,"EFO_0000685","rheumatoid arthritis","Immune system disorder",3475
"M72","Skin and subcutaneous diseases",1,16,0.933333278,5.96046447753906e-07,0.933333278,5.96046447753906e-07,16,1,204,204,0,2.98023223876953e-07,1.31219180662241e-06,TRUE,TRUE,"skin and subcutaneous diseases","Skin and subcutaneous diseases",653,2,"A46-A46.0, A66-A67.3, A67.9, B07-B09, B35-B36.9, B85-B88.9, D86.3, E80.1-E80.29, I89.1-I89.8, L00-L23.2, L23.4-L27, L27.2-L54.8, L56, L56.2-L57.9, L59-L64, L64.8-L75.9, L77-L92.9, L94-L99.8, M72.5-M72.6, N49.2-N49.3, R20-R24.0","A46-A46.0, A66-A67.9, B07-B08.1, B35-B36.9, B85-B88.9, I89.1-I89.8, L00-L23.2, L23.4-L25.9, L28-L54.8, L56, L56.2-L57.9, L59-L64, L64.8-L75.9, L80-L92.9, L94-L99.8, M72.5-M72.6, N49.2-N49.3","035-035.9, 040.0, 078.0-078.19, 102-103.9, 110-111.9, 132-134.9, 136.1, 457.2-457.3, 680-709.3, 709.8-709.9, 728.86, 782-782.9, 785.4, V13.3, V19.4, V42.3, V43.83, V58.77, V59.1, V82.0","035-035.9, 040.0, 078.0-078.19, 102-111.9, 132-134.9, 136.1, 457.2-457.3, 680-709.3, 709.8-709.9, 728.86, 785.4","Non-communicable diseases","Skin and subcutaneous diseases","","","icd10","both_sexes","","","M72 Fibroblastic disorders","truncated: true",NA,"Chapter XIII Diseases of the musculoskeletal system and connective tissue | M70-M79 Other soft tissue disorders | M72 Fibroblastic disorders",3450,943,2507,NA,NA,NA,"EUR",1,"",0,NA,NA,NA,NA,3450,NA,NA,NA,NA,NA,417081,NA,NA,NA,NA,NA,0.0141,NA,NA,NA,NA,NA,0.0033,NA,NA,NA,NA,NA,0.228,NA,NA,NA,NA,NA,0.0535,NA,NA,NA,NA,NA,4.27,NA,NA,NA,NA,NA,1.07,NA,NA,NA,NA,NA,"not_EUR_plus_1",NA,FALSE,"icd10-M72-both_sexes.tsv.bgz","icd10-M72-both_sexes.tsv.bgz.tbi","https://pan-ukb-us-east-1.s3.amazonaws.com/sumstats_flat_files/icd10-M72-both_sexes.tsv.bgz","https://pan-ukb-us-east-1.s3.amazonaws.com/sumstats_flat_files_tabix/icd10-M72-both_sexes.tsv.bgz.tbi","wget https://pan-ukb-us-east-1.s3.amazonaws.com/sumstats_flat_files/icd10-M72-both_sexes.tsv.bgz","wget https://pan-ukb-us-east-1.s3.amazonaws.com/sumstats_flat_files_tabix/icd10-M72-both_sexes.tsv.bgz.tbi","7772a9c325d9e6b32d926f32a8cfc373",546059354,"3f7b145a5f8c43c1230a0e83034d2e58",1751275,"EFO_0009432","fibroblastic disorder","Other disease",3450
"E14","Chronic kidney disease",1,14,0.97802192,1.43051147460938e-06,0.849999964,5.48362731933594e-06,16,1,204,204,0,7.1525573730469e-07,2.57317612810834e-06,TRUE,TRUE,"chronic kidney disease","Chronic kidney disease",589,3,"D63.1, E08.2-E08.29, E10.2-E10.29, E11.2-E11.29, E12.2, E13.2-E13.29, E14.2, I12-I13.9, N02-N08.8, N15.0, N17-N19, Q60-Q63.2, Q63.8-Q63.9, Q64.2-Q64.9","D63.1, E08.2-E08.29, E10.2-E10.29, E11.2-E11.29, E12.2, E13.2-E13.29, E14.2, I12-I13.9, N02-N08.8, N15.0, N17-N19, P96.0-P96.0","249.4-249.41, 250.4-250.49, 285.21, 403-404.93, 581-587.9, 753.0-753.4, 753.6-753.9, V13.03-V13.09, V18.6, V18.69, V42.0, V45.1-V45.12, V45.73, V56-V56.8, V59.4, V81.5-V81.6","249.4-249.41, 250.4-250.49, 285.21, 403-404.93, 581-587.9","Non-communicable diseases","Diabetes and kidney diseases","Chronic kidney disease","","icd10","both_sexes","","","E14 Unspecified diabetes mellitus","truncated: true",NA,"Chapter IV Endocrine, nutritional and metabolic diseases | E10-E14 Diabetes mellitus | E14 Unspecified diabetes mellitus",3350,1294,2056,NA,NA,NA,"AFR,CSA,EUR",3,"",0,140,NA,190,NA,3020,NA,6496,NA,8686,NA,417511,NA,-0.145,NA,0.19,NA,-5e-04,NA,0.101,NA,0.0397,NA,0.0022,NA,-1.16,NA,1.51,NA,-0.00897,NA,0.81,NA,0.316,NA,0.0395,NA,-1.44,NA,4.79,NA,-0.227,NA,0.984,NA,1.05,NA,1.07,NA,"h2_z_insignificant",NA,"not_EUR_plus_1",NA,"h2_z_insignificant",NA,FALSE,"icd10-E14-both_sexes.tsv.bgz","icd10-E14-both_sexes.tsv.bgz.tbi","https://pan-ukb-us-east-1.s3.amazonaws.com/sumstats_flat_files/icd10-E14-both_sexes.tsv.bgz","https://pan-ukb-us-east-1.s3.amazonaws.com/sumstats_flat_files_tabix/icd10-E14-both_sexes.tsv.bgz.tbi","wget https://pan-ukb-us-east-1.s3.amazonaws.com/sumstats_flat_files/icd10-E14-both_sexes.tsv.bgz","wget https://pan-ukb-us-east-1.s3.amazonaws.com/sumstats_flat_files_tabix/icd10-E14-both_sexes.tsv.bgz.tbi","9e393d87c5c3387f6ceb427ecef72101",1602786269,"b0dac593c21c1dc6a9ecbbe1f6f7c60f",2049265,"EFO_0000400","diabetes mellitus","Digestive system disorder",3350
