"ICD10_explo","df_name","window_optimum_start","window_optimum_end","MK_Tau_opt","MK_p_value_opt","MK_Tau","MK_p_value","Unique_Observations","prop_sig","n_countries","pos_sig","neg_sig","p_one","q_bh","ARD_BH","ARD_selected","X_key_GBD","Cause.Name","Cause.ID","Cause.Hierarchy.Level","ICD10","ICD10.Used.in.Hospital.Claims.Analyses","ICD9","ICD9.Used.in.Hospital.Claims.Analyses","cause_level_1","cause_level_2","cause_level_3","cause_level_4","trait_type","pheno_sex","coding","modifier","description","description_more","coding_description","category","n_cases_full_cohort_both_sexes","n_cases_full_cohort_females","n_cases_full_cohort_males","n_cases_hq_cohort_both_sexes","n_cases_hq_cohort_females","n_cases_hq_cohort_males","pops","num_pops","pops_pass_qc","num_pops_pass_qc","n_cases_AFR","n_cases_AMR","n_cases_CSA","n_cases_EAS","n_cases_EUR","n_cases_MID","n_controls_AFR","n_controls_AMR","n_controls_CSA","n_controls_EAS","n_controls_EUR","n_controls_MID","rhemc_25bin_50rv_h2_observed_AFR","rhemc_25bin_50rv_h2_observed_AMR","rhemc_25bin_50rv_h2_observed_CSA","rhemc_25bin_50rv_h2_observed_EAS","sldsc_25bin_h2_observed_EUR","rhemc_25bin_50rv_h2_observed_MID","rhemc_25bin_50rv_h2_observed_se_AFR","rhemc_25bin_50rv_h2_observed_se_AMR","rhemc_25bin_50rv_h2_observed_se_CSA","rhemc_25bin_50rv_h2_observed_se_EAS","sldsc_25bin_h2_observed_se_EUR","rhemc_25bin_50rv_h2_observed_se_MID","rhemc_25bin_50rv_h2_liability_AFR","rhemc_25bin_50rv_h2_liability_AMR","rhemc_25bin_50rv_h2_liability_CSA","rhemc_25bin_50rv_h2_liability_EAS","sldsc_25bin_h2_liability_EUR","rhemc_25bin_50rv_h2_liability_MID","rhemc_25bin_50rv_h2_liability_se_AFR","rhemc_25bin_50rv_h2_liability_se_AMR","rhemc_25bin_50rv_h2_liability_se_CSA","rhemc_25bin_50rv_h2_liability_se_EAS","sldsc_25bin_h2_liability_se_EUR","rhemc_25bin_50rv_h2_liability_se_MID","rhemc_25bin_50rv_h2_z_AFR","rhemc_25bin_50rv_h2_z_AMR","rhemc_25bin_50rv_h2_z_CSA","rhemc_25bin_50rv_h2_z_EAS","sldsc_25bin_h2_z_EUR","rhemc_25bin_50rv_h2_z_MID","lambda_gc_AFR","lambda_gc_AMR","lambda_gc_CSA","lambda_gc_EAS","lambda_gc_EUR","lambda_gc_MID","phenotype_qc_AFR","phenotype_qc_AMR","phenotype_qc_CSA","phenotype_qc_EAS","phenotype_qc_EUR","phenotype_qc_MID","in_max_independent_set","filename","filename_tabix","aws_link","aws_link_tabix","wget","wget_tabix","md5_hex","size_in_bytes","md5_hex_tabix","size_in_bytes_tabix","trait_efos","trait_efo_terms","trait_efo_categories",".cases_num"
"E78","Endocrine, metabolic, blood, and immune disorders",1,16,0.783333302,2.82526016235352e-05,0.783333302,2.82526016235352e-05,16,1,204,204,0,1.41263008117676e-05,3.56175960638585e-05,TRUE,TRUE,"endocrine, metabolic, blood, and immune disorders","Endocrine, metabolic, blood, and immune disorders",619,3,"C7A00-C7B8, D3A00-D3A8, D66-D69.49, D69.6-D70.0, D70.4-D77, D79-D85, D86.8, D86.82-D86.84, D86.86-D86.89, D87-D89.2, D89.8, D89.82-D99, E03-E03.1, E03.3-E06.3, E06.5-E07.9, E15-E16, E16.1-E23.0, E23.2-E24.1, E24.3, E24.8-E27.2, E27.4-E28.1, E28.3-E34, E34.1-E35.8, E37-E39, E47-E49., E62, E65-E66.09, E66.2-E80.09, E80.3-E85.9, E88-E88.9, E90-E998","D66-D69.49, D69.8-D70.0, D70.4-D75.81, D75.89-D77, D80-D84.9, D86.3-D86.89, D89-D89.8, D89.82-D89.9, E03-E03.1, E03.3-E06.3, E06.5-E07.9, E15-E16, E16.1-E23.0, E23.2-E24.1, E24.3-E27.2, E27.4-E28.1, E28.3-E34, E34.1-E35.8, E67-E71.42, E71.44-E88.9, E90-E99.9","240-244, 244.8-246.9, 251-251.2, 251.4-253.6, 253.8-256.39, 256.8-259.9, 270-273.9, 275-278.02, 278.1-279.49, 279.6-279.9, 286-289.9, 775.3, V12.2-V12.49, V18.1-V18.19, V45.86, V77.0, V77.3-V77.4, V77.6-V77.8, V77.91, V85-V85.45, V85.51, V85.53-V85.54","240-244, 244.8-246.9, 251-251.2, 251.4-253.6, 253.8-256.39, 256.8-259.9, 270-273.9, 275-279.49, 279.6-279.9, 286-289.9","Non-communicable diseases","Other non-communicable diseases","Endocrine, metabolic, blood, and immune disorders","","icd10","both_sexes","","","E78 Disorders of lipoprotein metabolism and other lipidaemias","truncated: true",NA,"Chapter IV Endocrine, nutritional and metabolic diseases | E70-E90 Metabolic disorders | E78 Disorders of lipoprotein metabolism and other lipidaemias",47240,18871,28368,NA,NA,NA,"AFR,AMR,CSA,EAS,EUR,MID",6,"",0,746,86,1804,190,44175,239,5890,894,7072,2519,376356,1360,0.104,0.188,0.189,-0.0977,0.0358,0.33,0.0643,0.135,0.0496,0.101,0.0041,0.0998,0.284,0.594,0.384,-0.353,0.102,0.775,0.176,0.427,0.1,0.363,0.0117,0.234,1.61,1.39,3.82,-0.971,8.73,3.31,0.994,0.977,0.98,0.998,1.1,0.971,"h2_z_insignificant","n_too_low","h2_z_insignificant","h2_z_insignificant","not_EUR_plus_1","h2_z_insignificant",FALSE,"icd10-E78-both_sexes.tsv.bgz","icd10-E78-both_sexes.tsv.bgz.tbi","https://pan-ukb-us-east-1.s3.amazonaws.com/sumstats_flat_files/icd10-E78-both_sexes.tsv.bgz","https://pan-ukb-us-east-1.s3.amazonaws.com/sumstats_flat_files_tabix/icd10-E78-both_sexes.tsv.bgz.tbi","wget https://pan-ukb-us-east-1.s3.amazonaws.com/sumstats_flat_files/icd10-E78-both_sexes.tsv.bgz","wget https://pan-ukb-us-east-1.s3.amazonaws.com/sumstats_flat_files_tabix/icd10-E78-both_sexes.tsv.bgz.tbi","494f6492750baa449cc79a89ede5ccc6",2400649843,"fc7fe289e66d98f7b7e313a48ae26d9c",2251325,NA,NA,NA,47240
"Z92","Adverse effects of medical treatment",1,16,0.99999994,1.19209289550781e-07,0.99999994,1.19209289550781e-07,16,0.955882352941176,204,195,0,5.96046447753905e-08,4.28862688018054e-07,TRUE,TRUE,"adverse effects of medical treatment","Adverse effects of medical treatment",708,3,"D69.5-D69.59, D70.1-D70.2, D78-D78.89, D89.81-D89.813, E03.2, E06.4, E09-E09.9, E16.0, E23.1, E24.2, E27.3, E36-E36.8, E66.1, E87.0-E87.99, E89-E89.9, G21.0-G21.19, G24.0-G24.09, G25.1, G25.4, G25.6-G25.79, G62.0, G72.0, G93.7, G96.0, G96.11, G97-G97.9, H05.33-H05.339, H05.42-H05.53, H59-H59.89, H91.0-H91.09, H95-H95.9, I95.2-I95.81, I97-I97.9, J70-J70.4, J95-J95.9, K08.5-K08.59, K43-K43.9, K52.0, K62.7, K68.11, K91-K91.9, K94-K95.89, L23.3, L27.0-L27.1, L56.0-L56.1, L64.0, L76-L76.82, M10.2-M10.29, M87.1-M87.19, M96-M96.9, N14-N14.4, N30.4-N30.41, N46.021, N46.121, N52.2-N52.39, N65-N65.1, N99-N99.9, P93-P93.8, P96.2, P96.5, R50.2-R50.83, Y40-Y84.9, Y88-Y88.3, Z21.0, Z42-Z51.9, Z88-Z94.0, Z94.6-Z99.9","D69.5-D69.59, D70.1-D70.2, D75.82, D78-D78.89, D89.81-D89.813, E03.2, E06.4, E09-E09.9, E16.0, E23.1, E24.2, E27.3, E36-E36.8, E66.1, E71.43, E89-E89.9, G21.0-G25.79, G62.0-G97.9, H05.33-H05.339, H05.42-H05.53, H59-H59.89, H91.0-H91.09, H95-H95.9, I95.2-I97.9, J70-J70.4, J95-J95.9, K08.5-K08.59, K43-K43.9, K52.0, K62.7, K68.11, K91-K91.9, K94-K95.89, L23.3, L27.0-L27.1, L56.0-L56.1, L64.0, L76-L76.82, M10.2-M10.29, M87.1-M87.19, M96-M96.9, N14-N14.4, N30.4-N30.41, N46.021-N46.121, N52.2-N52.39, N65-N65.1, N99-N99.9, P93-P93.8, P96.2-P96.5, R50.2-R50.83, Y40-Y84.9, Y88-Y88.3, Z21.0, Z42-Z51.9, Z88-Z94.0, Z94.6-Z99.9","244.0-244.1, 244.3, 251.3, 253.7, 279.5-279.53, 331.81, 333.92, 349-349.9, 357.6, 359.24, 379.6-379.63, 440.3-440.32, 457.0, 458.2-458.29, 518.6-518.7, 519.0-519.1, 525.6-525.79, 526.62-526.63, 530.86-530.87, 536.4-536.49, 539-539.9, 551.2-551.29, 552.2-552.29, 553.2-553.29, 564.2-564.4, 569.6-569.8, 579.3, 595.82, 596.81-596.83, 598.2, 612-612.1, 779.4-779.5, 780.62-780.66, 995.89, E870-E876.9, E878-E879.9, E930-E949.9, V44-V45, V45.2-V45.4, V45.7, V45.77, V45.79-V45.8, V45.87-V45.89","244.0-244.1, 244.3, 251.3, 253.7, 279.5-279.53, 331.81, 333.92, 349-349.9, 357.6-359.24, 379.6-379.63, 440.3-440.32, 457.0, 458.2-458.29, 518.6-519.1, 525.6-525.79, 526.62-526.63, 530.86-530.87, 536.4-536.49, 539-539.9, 551.2-551.29, 552.2-552.29, 553.2-553.29, 564.2-564.4, 569.6-569.8, 579.3, 595.82, 596.81-596.83, 598.2, 612-612.1, 779.4-780.66, 995.89, E87.0-E87.99, E93.0-E94.99, V44-V45.89","Injuries","Unintentional injuries","Adverse effects of medical treatment","","icd10","both_sexes","","","Z92 Personal history of medical treatment","truncated: true",NA,"Chapter XXI Factors influencing health status and contact with health services | Z80-Z99 Persons with potential health hazards related to family and personal history and certain conditions influencing health status | Z92 Personal history of medical treatment",41524,17523,24000,NA,NA,NA,"AFR,AMR,CSA,EAS,EUR,MID",6,"",0,455,73,895,114,39866,121,6181,907,7981,2595,380665,1478,0.287,1.19,0.14,0.221,0.016,0.217,0.113,0.37,0.0409,0.0978,0.0026,0.0943,1.05,4.13,0.408,1.11,0.0482,0.749,0.412,1.29,0.119,0.489,0.00783,0.325,2.54,3.21,3.42,2.26,6.15,2.3,0.975,1.04,1.02,1.02,1.1,1.03,"h2_z_insignificant","n_too_low","h2_z_insignificant","h2_z_insignificant","not_EUR_plus_1","h2_z_insignificant",FALSE,"icd10-Z92-both_sexes.tsv.bgz","icd10-Z92-both_sexes.tsv.bgz.tbi","https://pan-ukb-us-east-1.s3.amazonaws.com/sumstats_flat_files/icd10-Z92-both_sexes.tsv.bgz","https://pan-ukb-us-east-1.s3.amazonaws.com/sumstats_flat_files_tabix/icd10-Z92-both_sexes.tsv.bgz.tbi","wget https://pan-ukb-us-east-1.s3.amazonaws.com/sumstats_flat_files/icd10-Z92-both_sexes.tsv.bgz","wget https://pan-ukb-us-east-1.s3.amazonaws.com/sumstats_flat_files_tabix/icd10-Z92-both_sexes.tsv.bgz.tbi","68c70a7108380fab7ccd250fa9844688",2386845393,"494469c67f6d12bfd214c566ddc913d5",2248764,NA,NA,NA,41524
"R07","Cardiovascular diseases",1,16,0.98333329,1.19209289550781e-07,0.98333329,1.19209289550781e-07,16,1,204,204,0,5.96046447753905e-08,4.28862688018054e-07,TRUE,TRUE,"cardiovascular diseases","Cardiovascular diseases",491,2,"B33.2-B33.24, D86.85, G45-G46.8, I00.0-I01.9, I02.0, I03-I11.9, I14-I27.0, I27.2-I83.93, I86-I89.0, I89.9-I95.1, I98, I98.4-ID5.9, K75.1, R00-R01.2, R07-R07.9","A32.82, B33.2-B33.24, B37.6, I01-I09.9, I20-I27.0, I33-I73.9","074.2, 074.21-074.23, 391-391.9, 392.0, 393-398.99, 402-402.91, 410-416.0, 417-417.9, 420-425.5, 425.7-440.29, 440.4-445.89, 447-454.9, 456, 456.3-457, 457.1, 457.8-458.1, 459-459.9, 785-785.3, V12.5-V12.59, V15.1, V17.1, V17.3-V17.49, V42.1-V42.2, V43.2-V43.5, V45.0-V45.09, V45.81-V45.82, V47.2, V58.61, V58.63, V58.66, V58.73, V81-V81.2","074.2-074.23, 112.81-115.94, 391-398.99, 410-416.0, 421-440.29, 440.4-443.9","Non-communicable diseases","Cardiovascular diseases","","","icd10","both_sexes","","","R07 Pain in throat and chest","truncated: true",NA,"Chapter XVIII Symptoms, signs and abnormal clinical and laboratory findings, not elsewhere classified | R00-R09 Symptoms and signs involving the circulatory and respiratory systems | R07 Pain in throat and chest",38860,19626,19232,37627,18906,18719,"AFR,AMR,CSA,EAS,EUR,MID",6,"CSA,EUR",2,782,99,1365,165,36262,187,5854,881,7511,2544,384269,1412,-0.0702,0.165,0.16,0.193,0.0208,0.241,0.0804,0.19,0.0387,0.0881,0.0026,0.0849,-0.187,0.481,0.371,0.761,0.0662,0.645,0.214,0.553,0.0896,0.347,0.00828,0.227,-0.873,0.87,4.14,2.2,8,2.84,0.967,1,1.02,1.02,1.09,0.974,"h2_z_insignificant","n_too_low","PASS","h2_z_insignificant","PASS","h2_z_insignificant",FALSE,"icd10-R07-both_sexes.tsv.bgz","icd10-R07-both_sexes.tsv.bgz.tbi","https://pan-ukb-us-east-1.s3.amazonaws.com/sumstats_flat_files/icd10-R07-both_sexes.tsv.bgz","https://pan-ukb-us-east-1.s3.amazonaws.com/sumstats_flat_files_tabix/icd10-R07-both_sexes.tsv.bgz.tbi","wget https://pan-ukb-us-east-1.s3.amazonaws.com/sumstats_flat_files/icd10-R07-both_sexes.tsv.bgz","wget https://pan-ukb-us-east-1.s3.amazonaws.com/sumstats_flat_files_tabix/icd10-R07-both_sexes.tsv.bgz.tbi","54c0c22edd96672895e1a233f0a4535f",2697847905,"1c26bfcc342216982ebb81640cd2f87a",2312813,"EFO_0003843","pain","Other trait",38860
"K29","Gastritis and duodenitis",1,11,0.890909135,0.000186324,0.283333302,0.137347102,16,1,204,204,0,9.3162059783935e-05,0.000206638,TRUE,TRUE,"gastritis and duodenitis","Gastritis and duodenitis",528,4,"K29-K29.91","K29-K29.91","535-535.9","535-535.9","Non-communicable diseases","Digestive diseases","Upper digestive system diseases","Gastritis and duodenitis","icd10","both_sexes","","","K29 Gastritis and duodenitis","truncated: true",NA,"Chapter XI Diseases of the digestive system | K20-K31 Diseases of oesophagus, stomach and duodenum | K29 Gastritis and duodenitis",37416,20014,17401,NA,NA,NA,"AFR,AMR,CSA,EAS,EUR,MID",6,"",0,557,96,981,193,35394,195,6079,884,7895,2516,385137,1404,0.0865,0.178,0.116,-0.0207,0.0154,0.282,0.0672,0.311,0.0409,0.11,0.0025,0.104,0.28,0.525,0.321,-0.0738,0.0498,0.737,0.217,0.921,0.113,0.393,0.00808,0.273,1.29,0.571,2.84,-0.188,6.16,2.7,0.992,0.985,0.973,1.01,1.08,0.954,"h2_z_insignificant","n_too_low","h2_z_insignificant","h2_z_insignificant","not_EUR_plus_1","h2_z_insignificant",FALSE,"icd10-K29-both_sexes.tsv.bgz","icd10-K29-both_sexes.tsv.bgz.tbi","https://pan-ukb-us-east-1.s3.amazonaws.com/sumstats_flat_files/icd10-K29-both_sexes.tsv.bgz","https://pan-ukb-us-east-1.s3.amazonaws.com/sumstats_flat_files_tabix/icd10-K29-both_sexes.tsv.bgz.tbi","wget https://pan-ukb-us-east-1.s3.amazonaws.com/sumstats_flat_files/icd10-K29-both_sexes.tsv.bgz","wget https://pan-ukb-us-east-1.s3.amazonaws.com/sumstats_flat_files_tabix/icd10-K29-both_sexes.tsv.bgz.tbi","06056ff1f3a650ab7f934da83e28d1bf",2389330803,"506ab935becf088fb4ae97923cd95338",2249593,"EFO_0000217","gastritis","Digestive system disorder",37416
"K57","Digestive diseases",1,12,0.969696879,1.56164169311523e-05,0.633333266,0.000733614,16,1,204,204,0,7.80820846557615e-06,2.17303914843865e-05,TRUE,TRUE,"digestive diseases","Digestive diseases",526,2,"I84-I85.9, I98.2, K15.9-K42.9, K44-K52, K52.2-K62, K62.4-K62.6, K62.8-K63.4, K63.8-K67, K67.8-K68.1, K68.12-K75, K75.2, K75.4-K76.2, K76.4-K90.9, K92-K93, K93.8, K96-K99, N29.0, N49.5, R11-R19.8, R85-R85.9, Z52.6, Z94.4","I84-I85.9, I98.2-I98.2, K20-K42.9, K44-K52, K52.2-K62, K62.4-K62.6, K62.8-K63.4, K63.8-K67, K67.8-K68.1, K68.12-K90.9, K92-K92.9, K93.8, R12-R18.9, R85-R85.9, Z52.6, Z94.4","455-455.9, 456.0-456.21, 530-530.85, 530.89-536.3, 536.8-538, 540-543.9, 550-551.1, 551.3-552.1, 552.3-553.1, 553.3-558.9, 560-560.39, 560.8-562.13, 564-564.1, 564.5-569, 569.1-569.5, 569.81-572, 572.2-579.2, 579.4-579.9, 784-784.99, 787-787.99, 789.9, 792.1-792.4, V12.7-V12.79, V18.5-V18.59, V42.7, V45.72, V45.75, V47.3, V58.75, V59.6","455-456.21, 530-530.85, 530.89-536.3, 536.8-538, 540-551.1, 551.3-552.1, 552.3-553.1, 553.3-564.1, 564.5-569, 569.1-569.5, 569.81-579.2, 579.4-579.9, 787.1-792.4, V42.7, V59.6","Non-communicable diseases","Digestive diseases","","","icd10","both_sexes","","","K57 Diverticular disease of intestine","truncated: true",NA,"Chapter XI Diseases of the digestive system | K55-K64 Other diseases of intestines | K57 Diverticular disease of intestine",36408,19234,17173,NA,NA,NA,"AFR,AMR,CSA,EUR,MID",5,"",0,298,64,352,NA,35617,77,6338,916,8524,NA,384914,1522,0.171,0.468,0.142,NA,0.0423,0.307,0.0737,0.216,0.043,NA,0.0032,0.11,0.821,1.76,0.741,NA,0.136,1.4,0.353,0.813,0.224,NA,0.0103,0.501,2.32,2.17,3.31,NA,13.2,2.8,0.999,1.02,1.02,NA,1.13,1.05,"h2_z_insignificant","n_too_low","h2_z_insignificant",NA,"not_EUR_plus_1","h2_z_insignificant",FALSE,"icd10-K57-both_sexes.tsv.bgz","icd10-K57-both_sexes.tsv.bgz.tbi","https://pan-ukb-us-east-1.s3.amazonaws.com/sumstats_flat_files/icd10-K57-both_sexes.tsv.bgz","https://pan-ukb-us-east-1.s3.amazonaws.com/sumstats_flat_files_tabix/icd10-K57-both_sexes.tsv.bgz.tbi","wget https://pan-ukb-us-east-1.s3.amazonaws.com/sumstats_flat_files/icd10-K57-both_sexes.tsv.bgz","wget https://pan-ukb-us-east-1.s3.amazonaws.com/sumstats_flat_files_tabix/icd10-K57-both_sexes.tsv.bgz.tbi","23e360ca08a47cf5dc98c609ead061cb",2162713738,"543d3327c396f7e6f5b32f6392d5c867",2196649,"EFO_1001460","diverticulitis","Digestive system disorder",36408
"K44","Digestive diseases",1,12,0.969696879,1.56164169311523e-05,0.633333266,0.000733614,16,1,204,204,0,7.80820846557615e-06,2.17303914843865e-05,TRUE,TRUE,"digestive diseases","Digestive diseases",526,2,"I84-I85.9, I98.2, K15.9-K42.9, K44-K52, K52.2-K62, K62.4-K62.6, K62.8-K63.4, K63.8-K67, K67.8-K68.1, K68.12-K75, K75.2, K75.4-K76.2, K76.4-K90.9, K92-K93, K93.8, K96-K99, N29.0, N49.5, R11-R19.8, R85-R85.9, Z52.6, Z94.4","I84-I85.9, I98.2-I98.2, K20-K42.9, K44-K52, K52.2-K62, K62.4-K62.6, K62.8-K63.4, K63.8-K67, K67.8-K68.1, K68.12-K90.9, K92-K92.9, K93.8, R12-R18.9, R85-R85.9, Z52.6, Z94.4","455-455.9, 456.0-456.21, 530-530.85, 530.89-536.3, 536.8-538, 540-543.9, 550-551.1, 551.3-552.1, 552.3-553.1, 553.3-558.9, 560-560.39, 560.8-562.13, 564-564.1, 564.5-569, 569.1-569.5, 569.81-572, 572.2-579.2, 579.4-579.9, 784-784.99, 787-787.99, 789.9, 792.1-792.4, V12.7-V12.79, V18.5-V18.59, V42.7, V45.72, V45.75, V47.3, V58.75, V59.6","455-456.21, 530-530.85, 530.89-536.3, 536.8-538, 540-551.1, 551.3-552.1, 552.3-553.1, 553.3-564.1, 564.5-569, 569.1-569.5, 569.81-579.2, 579.4-579.9, 787.1-792.4, V42.7, V59.6","Non-communicable diseases","Digestive diseases","","","icd10","both_sexes","","","K44 Diaphragmatic hernia","truncated: true",NA,"Chapter XI Diseases of the digestive system | K40-K46 Hernia | K44 Diaphragmatic hernia",34642,19617,15023,33498,18931,14565,"AFR,AMR,CSA,EAS,EUR,MID",6,"EUR,MID",2,326,70,660,88,33359,139,6310,910,8216,2621,387172,1460,-0.0433,0.236,0.171,0.146,0.0291,0.632,0.0838,0.204,0.0429,0.0814,0.0029,0.129,-0.196,0.842,0.597,0.866,0.0974,2,0.378,0.726,0.149,0.484,0.00971,0.41,-0.517,1.16,4,1.79,10,4.88,0.995,1.02,1.02,1.02,1.1,0.984,"h2_z_insignificant","n_too_low","h2_z_insignificant","h2_z_insignificant","PASS","PASS",FALSE,"icd10-K44-both_sexes.tsv.bgz","icd10-K44-both_sexes.tsv.bgz.tbi","https://pan-ukb-us-east-1.s3.amazonaws.com/sumstats_flat_files/icd10-K44-both_sexes.tsv.bgz","https://pan-ukb-us-east-1.s3.amazonaws.com/sumstats_flat_files_tabix/icd10-K44-both_sexes.tsv.bgz.tbi","wget https://pan-ukb-us-east-1.s3.amazonaws.com/sumstats_flat_files/icd10-K44-both_sexes.tsv.bgz","wget https://pan-ukb-us-east-1.s3.amazonaws.com/sumstats_flat_files_tabix/icd10-K44-both_sexes.tsv.bgz.tbi","8eae832063a90ae52255c9da5234bdbb",2675102731,"d36d8d6cd36c25e1028cfeea23af31a8",2309448,"EFO_0008561","diaphragmatic hernia","Other trait",34642
"Z88","Adverse effects of medical treatment",1,16,0.99999994,1.19209289550781e-07,0.99999994,1.19209289550781e-07,16,0.955882352941176,204,195,0,5.96046447753905e-08,4.28862688018054e-07,TRUE,TRUE,"adverse effects of medical treatment","Adverse effects of medical treatment",708,3,"D69.5-D69.59, D70.1-D70.2, D78-D78.89, D89.81-D89.813, E03.2, E06.4, E09-E09.9, E16.0, E23.1, E24.2, E27.3, E36-E36.8, E66.1, E87.0-E87.99, E89-E89.9, G21.0-G21.19, G24.0-G24.09, G25.1, G25.4, G25.6-G25.79, G62.0, G72.0, G93.7, G96.0, G96.11, G97-G97.9, H05.33-H05.339, H05.42-H05.53, H59-H59.89, H91.0-H91.09, H95-H95.9, I95.2-I95.81, I97-I97.9, J70-J70.4, J95-J95.9, K08.5-K08.59, K43-K43.9, K52.0, K62.7, K68.11, K91-K91.9, K94-K95.89, L23.3, L27.0-L27.1, L56.0-L56.1, L64.0, L76-L76.82, M10.2-M10.29, M87.1-M87.19, M96-M96.9, N14-N14.4, N30.4-N30.41, N46.021, N46.121, N52.2-N52.39, N65-N65.1, N99-N99.9, P93-P93.8, P96.2, P96.5, R50.2-R50.83, Y40-Y84.9, Y88-Y88.3, Z21.0, Z42-Z51.9, Z88-Z94.0, Z94.6-Z99.9","D69.5-D69.59, D70.1-D70.2, D75.82, D78-D78.89, D89.81-D89.813, E03.2, E06.4, E09-E09.9, E16.0, E23.1, E24.2, E27.3, E36-E36.8, E66.1, E71.43, E89-E89.9, G21.0-G25.79, G62.0-G97.9, H05.33-H05.339, H05.42-H05.53, H59-H59.89, H91.0-H91.09, H95-H95.9, I95.2-I97.9, J70-J70.4, J95-J95.9, K08.5-K08.59, K43-K43.9, K52.0, K62.7, K68.11, K91-K91.9, K94-K95.89, L23.3, L27.0-L27.1, L56.0-L56.1, L64.0, L76-L76.82, M10.2-M10.29, M87.1-M87.19, M96-M96.9, N14-N14.4, N30.4-N30.41, N46.021-N46.121, N52.2-N52.39, N65-N65.1, N99-N99.9, P93-P93.8, P96.2-P96.5, R50.2-R50.83, Y40-Y84.9, Y88-Y88.3, Z21.0, Z42-Z51.9, Z88-Z94.0, Z94.6-Z99.9","244.0-244.1, 244.3, 251.3, 253.7, 279.5-279.53, 331.81, 333.92, 349-349.9, 357.6, 359.24, 379.6-379.63, 440.3-440.32, 457.0, 458.2-458.29, 518.6-518.7, 519.0-519.1, 525.6-525.79, 526.62-526.63, 530.86-530.87, 536.4-536.49, 539-539.9, 551.2-551.29, 552.2-552.29, 553.2-553.29, 564.2-564.4, 569.6-569.8, 579.3, 595.82, 596.81-596.83, 598.2, 612-612.1, 779.4-779.5, 780.62-780.66, 995.89, E870-E876.9, E878-E879.9, E930-E949.9, V44-V45, V45.2-V45.4, V45.7, V45.77, V45.79-V45.8, V45.87-V45.89","244.0-244.1, 244.3, 251.3, 253.7, 279.5-279.53, 331.81, 333.92, 349-349.9, 357.6-359.24, 379.6-379.63, 440.3-440.32, 457.0, 458.2-458.29, 518.6-519.1, 525.6-525.79, 526.62-526.63, 530.86-530.87, 536.4-536.49, 539-539.9, 551.2-551.29, 552.2-552.29, 553.2-553.29, 564.2-564.4, 569.6-569.8, 579.3, 595.82, 596.81-596.83, 598.2, 612-612.1, 779.4-780.66, 995.89, E87.0-E87.99, E93.0-E94.99, V44-V45.89","Injuries","Unintentional injuries","Adverse effects of medical treatment","","icd10","both_sexes","","","Z88 Personal history of allergy to drugs, medicaments and biologocal substances","truncated: true",NA,"Chapter XXI Factors influencing health status and contact with health services | Z80-Z99 Persons with potential health hazards related to family and personal history and certain conditions influencing health status | Z88 Personal history of allergy to drugs, medicaments and biologocal substances",33985,22809,11175,33151,22147,11003,"AFR,AMR,CSA,EAS,EUR,MID",6,"CSA,EUR",2,510,55,638,161,32513,108,6126,925,8238,2548,388018,1491,0.106,0.108,0.209,0.242,0.0153,0.196,0.0892,0.227,0.0443,0.103,0.0025,0.119,0.361,0.447,0.744,0.966,0.052,0.722,0.304,0.939,0.157,0.413,0.0085,0.44,1.19,0.476,4.73,2.34,6.12,1.64,0.986,1.02,1.01,1.01,1.07,1.04,"h2_z_insignificant","n_too_low","PASS","h2_z_insignificant","PASS","h2_z_insignificant",FALSE,"icd10-Z88-both_sexes.tsv.bgz","icd10-Z88-both_sexes.tsv.bgz.tbi","https://pan-ukb-us-east-1.s3.amazonaws.com/sumstats_flat_files/icd10-Z88-both_sexes.tsv.bgz","https://pan-ukb-us-east-1.s3.amazonaws.com/sumstats_flat_files_tabix/icd10-Z88-both_sexes.tsv.bgz.tbi","wget https://pan-ukb-us-east-1.s3.amazonaws.com/sumstats_flat_files/icd10-Z88-both_sexes.tsv.bgz","wget https://pan-ukb-us-east-1.s3.amazonaws.com/sumstats_flat_files_tabix/icd10-Z88-both_sexes.tsv.bgz.tbi","e0a570434ad0002498fe7729c263bdca",2668533980,"bea98816a2ec9d5d6e1e889e31af150d",2310455,NA,NA,NA,33985
"I25","Cardiovascular diseases",1,16,0.98333329,1.19209289550781e-07,0.98333329,1.19209289550781e-07,16,1,204,204,0,5.96046447753905e-08,4.28862688018054e-07,TRUE,TRUE,"cardiovascular diseases","Cardiovascular diseases",491,2,"B33.2-B33.24, D86.85, G45-G46.8, I00.0-I01.9, I02.0, I03-I11.9, I14-I27.0, I27.2-I83.93, I86-I89.0, I89.9-I95.1, I98, I98.4-ID5.9, K75.1, R00-R01.2, R07-R07.9","A32.82, B33.2-B33.24, B37.6, I01-I09.9, I20-I27.0, I33-I73.9","074.2, 074.21-074.23, 391-391.9, 392.0, 393-398.99, 402-402.91, 410-416.0, 417-417.9, 420-425.5, 425.7-440.29, 440.4-445.89, 447-454.9, 456, 456.3-457, 457.1, 457.8-458.1, 459-459.9, 785-785.3, V12.5-V12.59, V15.1, V17.1, V17.3-V17.49, V42.1-V42.2, V43.2-V43.5, V45.0-V45.09, V45.81-V45.82, V47.2, V58.61, V58.63, V58.66, V58.73, V81-V81.2","074.2-074.23, 112.81-115.94, 391-398.99, 410-416.0, 421-440.29, 440.4-443.9","Non-communicable diseases","Cardiovascular diseases","","","icd10","both_sexes","","","I25 Chronic ischaemic heart disease","truncated: true",NA,"Chapter IX Diseases of the circulatory system | I20-I25 Ischaemic heart diseases | I25 Chronic ischaemic heart disease",32926,9514,23411,32353,9255,23098,"AFR,AMR,CSA,EAS,EUR,MID",6,"CSA,EUR",2,302,52,1205,83,31148,136,6334,928,7671,2626,389383,1463,0.0412,0.805,0.202,0.434,0.0362,0.112,0.0936,0.465,0.0437,0.129,0.0032,0.125,0.195,3.46,0.5,2.69,0.126,0.361,0.444,2,0.108,0.796,0.0112,0.401,0.44,1.73,4.64,3.38,11.3,0.899,0.997,1.02,0.983,1.02,1.11,1.01,"h2_z_insignificant","n_too_low","PASS","h2_z_insignificant","PASS","h2_z_insignificant",FALSE,"icd10-I25-both_sexes.tsv.bgz","icd10-I25-both_sexes.tsv.bgz.tbi","https://pan-ukb-us-east-1.s3.amazonaws.com/sumstats_flat_files/icd10-I25-both_sexes.tsv.bgz","https://pan-ukb-us-east-1.s3.amazonaws.com/sumstats_flat_files_tabix/icd10-I25-both_sexes.tsv.bgz.tbi","wget https://pan-ukb-us-east-1.s3.amazonaws.com/sumstats_flat_files/icd10-I25-both_sexes.tsv.bgz","wget https://pan-ukb-us-east-1.s3.amazonaws.com/sumstats_flat_files_tabix/icd10-I25-both_sexes.tsv.bgz.tbi","6d2c168640a02b336ecf19358021b3ad",2659255597,"745f01d1a1d9c28f4b3d33ad563429d0",2309823,"EFO_0001645","coronary artery disease","Cardiovascular disease",32926
